id,user_id,restaurant_id,date,review_comment,score,picture_food
223,24,75,2018-05-04,Nesciunt consectetur non beatae minima dolor repellat ut. A voluptates omnis et qui. Non voluptate quibusdam aut sit necessitatibus totam veritatis.,https://s3-us-west-1.amazonaws.com/hrfrontendcapstone/regular_7.png,https://s3-us-west-1.amazonaws.com/hrfrontendcapstone/8.jpeg
224,59,40,2018-05-27,Omnis voluptas vero exercitationem debitis atque. Dolorem aliquam sunt labore. Alias minus adipisci qui cupiditate consequatur.,https://s3-us-west-1.amazonaws.com/hrfrontendcapstone/regular_3.png,https://s3-us-west-1.amazonaws.com/hrfrontendcapstone/1.jpeg
225,62,70,2018-04-24,Illum ab quis fuga sit error. Repudiandae est consectetur. Facilis enim assumenda expedita vero voluptatem. Amet quia qui eum quaerat hic. Qui hic sit in consequuntur tenetur voluptatem necessitatibus non ut.,https://s3-us-west-1.amazonaws.com/hrfrontendcapstone/regular_2.png,https://s3-us-west-1.amazonaws.com/hrfrontendcapstone/9.jpeg
226,88,13,2017-12-17,Id vitae voluptas perferendis aperiam quisquam fuga laudantium dolorem. Et tempora animi reprehenderit sint officiis occaecati. Repudiandae delectus et esse. Est et vel.,https://s3-us-west-1.amazonaws.com/hrfrontendcapstone/regular_3.png,https://s3-us-west-1.amazonaws.com/hrfrontendcapstone/9.jpeg
227,79,35,2018-05-25,Consequatur aperiam nostrum et sit similique et voluptas repellat similique. Itaque veritatis quidem corporis dolorem quam voluptatem facere. Eaque eveniet quisquam quod illo non voluptatem. Id sint necessitatibus repellat fugiat tenetur. Soluta accusantium aut consequatur quam et inventore et. Quos voluptatem quaerat facilis voluptatum illum eum est fugiat.,https://s3-us-west-1.amazonaws.com/hrfrontendcapstone/regular_5.png,https://s3-us-west-1.amazonaws.com/hrfrontendcapstone/8.jpeg
228,43,6,2018-04-04,Aspernatur deserunt praesentium dignissimos tempore reprehenderit. Sint doloremque et ut molestias inventore non architecto perferendis. Animi quo soluta libero quod est. Quia et facilis facere beatae. Minus maiores debitis necessitatibus modi laboriosam.,https://s3-us-west-1.amazonaws.com/hrfrontendcapstone/regular_4.png,https://s3-us-west-1.amazonaws.com/hrfrontendcapstone/2.jpeg
229,100,35,2018-08-20,Vitae autem voluptates. Facere aspernatur veritatis consectetur aut harum rem. Itaque blanditiis ex ratione aliquid tenetur perferendis. Laborum molestiae quia atque aut ex et eum laudantium. Fugiat odio et incidunt. Consequatur quo dolore dignissimos modi praesentium.,https://s3-us-west-1.amazonaws.com/hrfrontendcapstone/regular_7.png,https://s3-us-west-1.amazonaws.com/hrfrontendcapstone/7.jpeg
230,2,39,2018-09-02,Sed corrupti nostrum sit qui quasi voluptas voluptas accusamus. Vitae aperiam temporibus aperiam iure libero dolor consequuntur aliquid. Ullam nobis autem officiis deserunt accusamus. Sint quas facilis amet neque mollitia molestias aut alias. Qui nemo soluta doloremque.,https://s3-us-west-1.amazonaws.com/hrfrontendcapstone/regular_7.png,https://s3-us-west-1.amazonaws.com/hrfrontendcapstone/6.jpeg
231,35,11,2018-05-14,At quod nulla soluta id cupiditate vel ab dolorem. Vel ullam error rerum nam. Commodi cumque maiores animi. Aut voluptatum sapiente adipisci exercitationem rem qui. A qui illo rerum dignissimos dolores reiciendis. Beatae debitis totam ut ut corrupti omnis.,https://s3-us-west-1.amazonaws.com/hrfrontendcapstone/regular_3.png,https://s3-us-west-1.amazonaws.com/hrfrontendcapstone/4.jpeg
232,99,52,2018-02-06,Repellat sit inventore omnis. Eos deleniti ut maxime. Adipisci distinctio quod a. Velit aperiam voluptatem ea quisquam autem sed.,https://s3-us-west-1.amazonaws.com/hrfrontendcapstone/regular_6.png,https://s3-us-west-1.amazonaws.com/hrfrontendcapstone/2.jpeg
233,16,51,2017-12-06,Eaque at enim doloremque non adipisci. Officiis est dolorem dignissimos quam repudiandae culpa saepe alias. Eveniet ut quisquam pariatur deleniti hic. Eum fuga non et ullam sit sed. Adipisci iusto explicabo rem. Quis tempore sit ad ut sint fugit et.,https://s3-us-west-1.amazonaws.com/hrfrontendcapstone/regular_8.png,https://s3-us-west-1.amazonaws.com/hrfrontendcapstone/2.jpeg
234,30,35,2018-06-06,Debitis facere sit vero iusto dolorem. Inventore repellendus et voluptatum autem temporibus. Eos voluptas animi et consequuntur. Est molestiae amet provident quia sit veniam. Voluptas ea unde quod nobis delectus fuga accusamus. Soluta aut ut sint.,https://s3-us-west-1.amazonaws.com/hrfrontendcapstone/regular_4.png,https://s3-us-west-1.amazonaws.com/hrfrontendcapstone/3.jpeg
235,29,49,2018-02-11,Nam quibusdam accusamus quo. Maxime voluptas est. Voluptas nulla veniam ipsa quo ex atque. Maxime voluptatem vel odio ab optio molestias eius. Dolorum unde et doloribus eos veniam. Voluptatem dolor aut enim quis et.,https://s3-us-west-1.amazonaws.com/hrfrontendcapstone/regular_3.png,https://s3-us-west-1.amazonaws.com/hrfrontendcapstone/5.jpeg
236,35,3,2018-06-08,Consequatur ad laudantium consequatur voluptatem autem ratione dolor porro id. Voluptatem exercitationem fugit est quisquam impedit ea quidem consequatur voluptatem. Ratione facere blanditiis et quod officiis omnis et voluptatem.,https://s3-us-west-1.amazonaws.com/hrfrontendcapstone/regular_1.png,https://s3-us-west-1.amazonaws.com/hrfrontendcapstone/1.jpeg
237,33,25,2018-05-05,Ipsam nihil iste quas non. Sequi ut quasi ipsa sint neque. Incidunt quas magni in dignissimos aut dolorum numquam officiis molestias.,https://s3-us-west-1.amazonaws.com/hrfrontendcapstone/regular_6.png,https://s3-us-west-1.amazonaws.com/hrfrontendcapstone/1.jpeg
238,55,81,2018-08-17,Unde quod labore magni est animi voluptate non tempore. Explicabo fugit eligendi ullam qui voluptatem aperiam. Magni animi nihil voluptatum aut blanditiis officia iusto officia. Ab quaerat ut neque pariatur totam nobis. Sunt sunt modi illo. Eos rerum et quam quis dolores nam ut minima quidem.,https://s3-us-west-1.amazonaws.com/hrfrontendcapstone/regular_9.png,https://s3-us-west-1.amazonaws.com/hrfrontendcapstone/1.jpeg
239,77,82,2018-01-17,Qui rerum cumque accusantium. Et autem consequatur aut molestias beatae unde nisi ipsa. Et voluptas rerum sint qui doloribus non et.,https://s3-us-west-1.amazonaws.com/hrfrontendcapstone/regular_1.png,https://s3-us-west-1.amazonaws.com/hrfrontendcapstone/4.jpeg
240,73,89,2018-08-04,Eos ipsum beatae enim deserunt reiciendis repellat. Rem dolor tempore maxime. Quae vel consequatur. Quidem voluptatem accusantium qui sint.,https://s3-us-west-1.amazonaws.com/hrfrontendcapstone/regular_5.png,https://s3-us-west-1.amazonaws.com/hrfrontendcapstone/3.jpeg
241,47,12,2018-08-26,Dolore doloribus optio rerum omnis eaque eos praesentium ut. Rem voluptatem dignissimos et ut blanditiis. Officiis numquam nisi. Explicabo quis officia est aperiam quo qui odit sint ut.,https://s3-us-west-1.amazonaws.com/hrfrontendcapstone/regular_7.png,https://s3-us-west-1.amazonaws.com/hrfrontendcapstone/1.jpeg
242,56,23,2018-02-06,Vitae sed et officia quas mollitia. Velit eos recusandae. Eveniet est beatae aut. Quae cupiditate dolorem enim. Nulla est rerum.,https://s3-us-west-1.amazonaws.com/hrfrontendcapstone/regular_8.png,https://s3-us-west-1.amazonaws.com/hrfrontendcapstone/8.jpeg
243,8,3,2018-07-09,Delectus aut deleniti rerum quia est. Et blanditiis officia odit nesciunt delectus debitis impedit reiciendis eius. Rerum dolore dolor.,https://s3-us-west-1.amazonaws.com/hrfrontendcapstone/regular_6.png,https://s3-us-west-1.amazonaws.com/hrfrontendcapstone/3.jpeg
244,70,57,2018-06-15,Qui est recusandae. Odio dolore quo ex nobis id ea recusandae vero. Culpa fugit sequi omnis velit. Harum alias numquam ut velit magni commodi quasi.,https://s3-us-west-1.amazonaws.com/hrfrontendcapstone/regular_9.png,https://s3-us-west-1.amazonaws.com/hrfrontendcapstone/4.jpeg
245,58,42,2018-05-10,Recusandae facilis eos possimus cumque aperiam quidem impedit quia. Sit molestias qui omnis dolores quidem fuga non non velit. Libero odio laborum provident aliquid quaerat quia. Commodi quae corrupti quia omnis omnis voluptatem reiciendis.,https://s3-us-west-1.amazonaws.com/hrfrontendcapstone/regular_9.png,https://s3-us-west-1.amazonaws.com/hrfrontendcapstone/6.jpeg
246,2,23,2018-09-08,Porro rem voluptas sit est architecto. Dolores qui adipisci possimus. Corrupti fuga corporis.,https://s3-us-west-1.amazonaws.com/hrfrontendcapstone/regular_3.png,https://s3-us-west-1.amazonaws.com/hrfrontendcapstone/4.jpeg
247,24,4,2018-09-15,Nostrum eius corporis. Vitae molestias dolorem nostrum qui cumque modi qui ad mollitia. Repellat et pariatur molestias provident eum perferendis. Ea eaque eos fuga eius voluptate laborum rerum accusantium voluptatibus. Nisi temporibus ut iusto nihil cum assumenda.,https://s3-us-west-1.amazonaws.com/hrfrontendcapstone/regular_7.png,https://s3-us-west-1.amazonaws.com/hrfrontendcapstone/9.jpeg
248,66,40,2018-01-10,Quo fugit cumque expedita ut. Earum id eaque blanditiis vero molestiae unde laborum. Qui voluptas cum. Dolorem ea nemo id aut.,https://s3-us-west-1.amazonaws.com/hrfrontendcapstone/regular_3.png,https://s3-us-west-1.amazonaws.com/hrfrontendcapstone/5.jpeg
249,93,79,2018-08-21,Aut illo eligendi sunt reiciendis sed. Et quae et. Aut dolores consequuntur sed beatae. Magni dolorem quo ipsa inventore qui. Magni quis libero.,https://s3-us-west-1.amazonaws.com/hrfrontendcapstone/regular_3.png,https://s3-us-west-1.amazonaws.com/hrfrontendcapstone/9.jpeg
250,96,49,2018-06-01,Magni ipsum aliquam ut suscipit aliquid nobis deleniti enim unde. Eos molestias aliquid assumenda facilis magni quia voluptatum. Velit quia molestiae explicabo maiores quae sint placeat facilis.,https://s3-us-west-1.amazonaws.com/hrfrontendcapstone/regular_3.png,https://s3-us-west-1.amazonaws.com/hrfrontendcapstone/2.jpeg
251,24,21,2018-10-09,Porro aut molestiae vero itaque aut enim et ut. Qui non quia. Soluta non omnis et illum molestiae beatae sit praesentium. Similique nulla nulla.,https://s3-us-west-1.amazonaws.com/hrfrontendcapstone/regular_2.png,https://s3-us-west-1.amazonaws.com/hrfrontendcapstone/5.jpeg
252,78,92,2018-04-09,Aut iure laboriosam earum excepturi. Maiores id est aut ea itaque. Vel sint dicta distinctio voluptatem repudiandae officia odio aut. Ab voluptates earum non quas excepturi itaque sit commodi similique. Distinctio id fugit rerum et molestias quia adipisci mollitia autem. Harum officia qui voluptatem numquam minus.,https://s3-us-west-1.amazonaws.com/hrfrontendcapstone/regular_8.png,https://s3-us-west-1.amazonaws.com/hrfrontendcapstone/6.jpeg
253,97,91,2018-06-17,Et unde consequatur. Iure reprehenderit ab ut quam in qui explicabo libero enim. Doloremque nostrum autem quod eveniet quia ab in.,https://s3-us-west-1.amazonaws.com/hrfrontendcapstone/regular_4.png,https://s3-us-west-1.amazonaws.com/hrfrontendcapstone/1.jpeg
254,18,88,2018-07-15,Dolorem id nemo ratione mollitia praesentium. Aut incidunt et natus quaerat iste illum. Voluptates et molestiae quam voluptas porro aut iusto hic. Quia nihil debitis recusandae nisi.,https://s3-us-west-1.amazonaws.com/hrfrontendcapstone/regular_5.png,https://s3-us-west-1.amazonaws.com/hrfrontendcapstone/8.jpeg
255,62,44,2018-03-28,Est voluptatum temporibus cum officia sed. Architecto incidunt nihil rerum ea magnam iure. Aut ducimus debitis tempora recusandae. Et quos dignissimos voluptatibus a eos voluptas rerum. Repudiandae rerum esse excepturi mollitia provident beatae exercitationem quod. Error labore repellat nostrum porro voluptatum nesciunt sit blanditiis.,https://s3-us-west-1.amazonaws.com/hrfrontendcapstone/regular_5.png,https://s3-us-west-1.amazonaws.com/hrfrontendcapstone/1.jpeg
256,68,7,2018-01-16,Ut autem aut accusamus assumenda est cumque. Aut non quia. Ea distinctio repellendus dignissimos aut ipsa voluptas id quaerat maxime. Sequi ut consequatur et recusandae suscipit impedit velit. Odio aut magni et.,https://s3-us-west-1.amazonaws.com/hrfrontendcapstone/regular_7.png,https://s3-us-west-1.amazonaws.com/hrfrontendcapstone/7.jpeg
257,19,41,2018-06-05,Ipsum voluptatem minima commodi qui minus est. A necessitatibus quia. Et a nemo voluptas dolor earum saepe corporis sint. Aut magnam aperiam deserunt qui aut et. Numquam consequatur dolores quo accusantium quia est harum et. Sunt blanditiis accusantium perferendis aut ut corporis rerum iure.,https://s3-us-west-1.amazonaws.com/hrfrontendcapstone/regular_6.png,https://s3-us-west-1.amazonaws.com/hrfrontendcapstone/5.jpeg
258,49,15,2018-01-02,Voluptatem vel quaerat architecto iure nobis unde. Nobis esse consequatur accusamus. Reiciendis et neque vel facilis placeat iusto quidem non et. Officia numquam et. Necessitatibus neque culpa. Sunt quo deleniti aperiam.,https://s3-us-west-1.amazonaws.com/hrfrontendcapstone/regular_4.png,https://s3-us-west-1.amazonaws.com/hrfrontendcapstone/1.jpeg
259,6,41,2018-09-09,Aut qui sunt facilis pariatur. Asperiores voluptatem pariatur qui saepe ex ipsum. Non hic vel mollitia sapiente. Omnis aut corrupti id quos enim blanditiis est alias quis. Accusamus soluta a recusandae.,https://s3-us-west-1.amazonaws.com/hrfrontendcapstone/regular_1.png,https://s3-us-west-1.amazonaws.com/hrfrontendcapstone/4.jpeg
260,4,97,2018-04-03,Corrupti dolores est alias maxime officiis in. Eveniet id et eos incidunt facilis. Molestiae perspiciatis voluptatum numquam rerum rerum dolore earum animi. Neque dolores illum illum omnis facilis ut vero quia.,https://s3-us-west-1.amazonaws.com/hrfrontendcapstone/regular_2.png,https://s3-us-west-1.amazonaws.com/hrfrontendcapstone/7.jpeg
261,100,23,2018-10-10,Ut ut ut iste. Neque nihil dolore nihil eaque ducimus cupiditate et. Maiores sit qui libero qui odio id error in. Rerum molestiae voluptatem aliquam sit sunt ut qui. Sit voluptatibus laudantium in rerum. Eveniet esse quibusdam.,https://s3-us-west-1.amazonaws.com/hrfrontendcapstone/regular_1.png,https://s3-us-west-1.amazonaws.com/hrfrontendcapstone/3.jpeg
262,29,37,2018-03-15,Rerum architecto praesentium nesciunt quia enim veritatis voluptas ex itaque. Eum omnis voluptatem adipisci. Soluta porro laudantium alias voluptatum. Ducimus ipsam dolorem incidunt eum. Sit facilis ullam et. In repellendus sit et tempore sit.,https://s3-us-west-1.amazonaws.com/hrfrontendcapstone/regular_1.png,https://s3-us-west-1.amazonaws.com/hrfrontendcapstone/8.jpeg
263,44,100,2018-11-12,Et est voluptatum earum deleniti. Id illum consequatur. Explicabo libero aut eum in voluptatem. Consequuntur ratione qui eius natus. Enim facere tempore quae atque nobis sapiente fugiat. Debitis non mollitia eius et qui non.,https://s3-us-west-1.amazonaws.com/hrfrontendcapstone/regular_6.png,https://s3-us-west-1.amazonaws.com/hrfrontendcapstone/3.jpeg
264,21,19,2018-08-29,Nihil dolore aliquid dolorum omnis dignissimos perferendis qui. Est explicabo fugit est. Ullam maxime occaecati est maiores quae tempore odit. Tempore id repellendus et. Iste rerum molestiae. Itaque enim debitis aut hic in velit qui.,https://s3-us-west-1.amazonaws.com/hrfrontendcapstone/regular_2.png,https://s3-us-west-1.amazonaws.com/hrfrontendcapstone/7.jpeg
265,76,33,2018-09-06,Libero omnis voluptas hic saepe dolores quia culpa. Exercitationem commodi et et aut. Dicta recusandae explicabo consequuntur natus. Culpa alias odit id et sint est occaecati culpa aut. Voluptatem sunt optio officia rem rerum vitae. Iste inventore neque.,https://s3-us-west-1.amazonaws.com/hrfrontendcapstone/regular_8.png,https://s3-us-west-1.amazonaws.com/hrfrontendcapstone/5.jpeg
266,36,12,2018-08-17,Quos aut voluptas. Quia quia quidem neque nesciunt doloribus quam consequatur porro. Magnam explicabo animi enim ut sint excepturi. Tempore non eos sed eveniet eum aspernatur aut est voluptatem. Deleniti placeat autem modi quae eaque et ipsum distinctio minus. Rem alias sed ratione incidunt pariatur soluta.,https://s3-us-west-1.amazonaws.com/hrfrontendcapstone/regular_5.png,https://s3-us-west-1.amazonaws.com/hrfrontendcapstone/9.jpeg
267,83,63,2018-05-19,Ducimus reprehenderit distinctio maxime in et rerum totam soluta temporibus. Exercitationem unde quae eveniet totam. Sed et aut laboriosam aperiam in saepe nisi ut blanditiis. Fugiat aut at modi atque. Non non architecto.,https://s3-us-west-1.amazonaws.com/hrfrontendcapstone/regular_6.png,https://s3-us-west-1.amazonaws.com/hrfrontendcapstone/8.jpeg
268,29,55,2018-07-17,Tempora voluptas sit impedit aperiam. Ipsam iusto fuga ipsam in. In est et enim.,https://s3-us-west-1.amazonaws.com/hrfrontendcapstone/regular_4.png,https://s3-us-west-1.amazonaws.com/hrfrontendcapstone/6.jpeg
269,78,57,2018-06-08,Laudantium quia deleniti aut. Assumenda minus veritatis nesciunt odio. Deleniti et adipisci. Sit molestias repudiandae nemo deserunt velit similique. Quasi dolor et architecto rerum. Id non consequuntur.,https://s3-us-west-1.amazonaws.com/hrfrontendcapstone/regular_7.png,https://s3-us-west-1.amazonaws.com/hrfrontendcapstone/6.jpeg
270,82,59,2018-08-15,Ullam qui unde ea maxime nisi. Quam corrupti optio sit quibusdam nostrum iure. Itaque sit ipsa dolor voluptates consequatur quos odit debitis.,https://s3-us-west-1.amazonaws.com/hrfrontendcapstone/regular_9.png,https://s3-us-west-1.amazonaws.com/hrfrontendcapstone/6.jpeg
271,26,56,2018-03-19,Sed in maiores possimus. Et quidem vel. Perspiciatis amet amet suscipit velit ea ipsa voluptas. Qui consectetur quis veritatis accusamus laudantium vero. Ipsam vel quam blanditiis quia vero vero facere. Porro perferendis nihil.,https://s3-us-west-1.amazonaws.com/hrfrontendcapstone/regular_7.png,https://s3-us-west-1.amazonaws.com/hrfrontendcapstone/9.jpeg
272,94,47,2018-03-16,Eos et eius laboriosam ratione id consequatur perferendis adipisci vero. Cupiditate est commodi numquam est vitae neque corrupti. Fugit fugit libero in. Iure quis distinctio quia in.,https://s3-us-west-1.amazonaws.com/hrfrontendcapstone/regular_1.png,https://s3-us-west-1.amazonaws.com/hrfrontendcapstone/6.jpeg
273,67,100,2018-11-03,Iusto voluptas blanditiis delectus dolore neque est doloribus est eius. Laudantium quia dolore qui ducimus minima minus. Provident laborum vel.,https://s3-us-west-1.amazonaws.com/hrfrontendcapstone/regular_3.png,https://s3-us-west-1.amazonaws.com/hrfrontendcapstone/4.jpeg
274,56,38,2018-07-24,Voluptatem est mollitia doloremque ducimus deserunt autem. Accusantium deserunt aut. Ratione neque distinctio unde consectetur.,https://s3-us-west-1.amazonaws.com/hrfrontendcapstone/regular_8.png,https://s3-us-west-1.amazonaws.com/hrfrontendcapstone/5.jpeg
275,61,63,2018-10-15,Qui ab eum eos et. Qui esse natus ratione ipsam esse esse totam. Illo ut ullam qui beatae itaque omnis. Consectetur aspernatur voluptas at quam. Aliquid in doloribus aut ut delectus. Totam voluptatem quas est voluptatem et excepturi modi omnis quis.,https://s3-us-west-1.amazonaws.com/hrfrontendcapstone/regular_4.png,https://s3-us-west-1.amazonaws.com/hrfrontendcapstone/7.jpeg
276,66,7,2018-03-21,Assumenda omnis repudiandae ipsam. Asperiores asperiores voluptatem qui quisquam temporibus cumque ex iste est. Facere rerum veritatis sint enim.,https://s3-us-west-1.amazonaws.com/hrfrontendcapstone/regular_2.png,https://s3-us-west-1.amazonaws.com/hrfrontendcapstone/8.jpeg
277,33,30,2017-11-22,Consectetur ratione in ipsum. Consequatur iste corporis accusantium ut quae non tempora in numquam. Ipsum aut libero. Minima quisquam ipsum eius totam blanditiis expedita dolores aut nobis.,https://s3-us-west-1.amazonaws.com/hrfrontendcapstone/regular_5.png,https://s3-us-west-1.amazonaws.com/hrfrontendcapstone/9.jpeg
278,49,73,2018-08-14,Ut sunt eaque qui ipsam non cupiditate est temporibus accusantium. Voluptas labore quos architecto. Natus libero consequatur dolores. Maiores explicabo sequi autem amet quia perspiciatis.,https://s3-us-west-1.amazonaws.com/hrfrontendcapstone/regular_2.png,https://s3-us-west-1.amazonaws.com/hrfrontendcapstone/1.jpeg
279,97,99,2018-07-24,Dicta ut qui unde. Numquam repudiandae qui asperiores commodi amet ut porro maiores. Natus fugit doloribus occaecati quis ut. Qui doloribus error dolorum qui nostrum. Sint sed vel vel sint dolor modi assumenda.,https://s3-us-west-1.amazonaws.com/hrfrontendcapstone/regular_2.png,https://s3-us-west-1.amazonaws.com/hrfrontendcapstone/4.jpeg
280,71,59,2018-04-30,Qui maxime porro amet accusamus vel officia quia. Aspernatur nam perferendis maxime minima iure harum nemo labore ea. Labore commodi itaque optio vel. Deleniti corrupti adipisci quae. Non aliquam delectus ab consectetur dolore natus vero quibusdam. Ea vitae quo quia.,https://s3-us-west-1.amazonaws.com/hrfrontendcapstone/regular_6.png,https://s3-us-west-1.amazonaws.com/hrfrontendcapstone/2.jpeg
281,97,70,2018-01-14,Dolores error fugiat error sit facilis. Sit minus voluptatum quis porro odit illum eaque. Ut quis ipsam architecto aperiam eum distinctio labore a alias. Nulla totam quasi recusandae voluptatem sit et fugiat.,https://s3-us-west-1.amazonaws.com/hrfrontendcapstone/regular_5.png,https://s3-us-west-1.amazonaws.com/hrfrontendcapstone/7.jpeg
282,23,79,2018-08-06,Qui facere illum a eum vel cupiditate est repellat. Consequatur rerum id corrupti. Corporis eligendi vel voluptatem aliquam dignissimos et occaecati aut. Dicta dolore voluptas reprehenderit dolore ab esse enim quisquam quo. Ea non aut nemo et est est molestias.,https://s3-us-west-1.amazonaws.com/hrfrontendcapstone/regular_4.png,https://s3-us-west-1.amazonaws.com/hrfrontendcapstone/5.jpeg
283,88,87,2018-04-14,Vitae pariatur ex. Incidunt reiciendis qui praesentium cum autem officia sequi unde qui. Maxime provident quibusdam.,https://s3-us-west-1.amazonaws.com/hrfrontendcapstone/regular_3.png,https://s3-us-west-1.amazonaws.com/hrfrontendcapstone/7.jpeg
284,58,40,2018-08-27,Quo eaque iusto doloremque pariatur ipsum et odio. Iure accusantium quidem deserunt asperiores iusto est dignissimos ducimus dolor. Sint sapiente quaerat quam. Et repellendus aut sit ex dolorem. Commodi perspiciatis qui aspernatur vitae necessitatibus vel. Accusantium rerum quos nisi voluptates.,https://s3-us-west-1.amazonaws.com/hrfrontendcapstone/regular_1.png,https://s3-us-west-1.amazonaws.com/hrfrontendcapstone/1.jpeg
285,17,55,2018-08-04,Sapiente sequi accusantium qui quo. Quas ipsum reiciendis neque voluptatibus sunt voluptatum velit minus. Modi dolor officiis magni ut magnam iure ut id. Qui aperiam deleniti ut molestiae non asperiores.,https://s3-us-west-1.amazonaws.com/hrfrontendcapstone/regular_2.png,https://s3-us-west-1.amazonaws.com/hrfrontendcapstone/1.jpeg
286,50,29,2018-07-14,Enim odit qui consequatur in sed. Sapiente rerum incidunt sunt cumque quidem. Ratione ratione quas dolorem ut sed consequatur aut perspiciatis. Est velit nemo corporis non quia vitae. Voluptatem excepturi quod asperiores vel maxime repudiandae ut. Aliquid deleniti officia sint est eos.,https://s3-us-west-1.amazonaws.com/hrfrontendcapstone/regular_6.png,https://s3-us-west-1.amazonaws.com/hrfrontendcapstone/2.jpeg
287,84,23,2018-04-09,Quas ad reiciendis recusandae voluptatibus in quo non nesciunt voluptatem. Voluptates doloribus dolores aperiam ratione corrupti distinctio similique voluptatibus. Voluptas necessitatibus architecto quia est officia dolorem quis molestiae dolor. Et reprehenderit quia sapiente molestias consequuntur quisquam.,https://s3-us-west-1.amazonaws.com/hrfrontendcapstone/regular_6.png,https://s3-us-west-1.amazonaws.com/hrfrontendcapstone/2.jpeg
288,41,83,2018-10-13,Necessitatibus ea quis ea quis explicabo placeat et voluptatem. Ex libero consequuntur unde quis ut eos et aut ducimus. Quisquam aut perspiciatis assumenda quia velit numquam culpa. Alias quod quis. Eius dolore natus aut.,https://s3-us-west-1.amazonaws.com/hrfrontendcapstone/regular_9.png,https://s3-us-west-1.amazonaws.com/hrfrontendcapstone/3.jpeg
289,8,59,2018-07-26,Error est cumque sequi architecto unde. Ut ex enim beatae quia fugit ullam laboriosam qui. Dolores eos omnis. Fugiat laboriosam cum soluta sit soluta.,https://s3-us-west-1.amazonaws.com/hrfrontendcapstone/regular_3.png,https://s3-us-west-1.amazonaws.com/hrfrontendcapstone/4.jpeg
290,51,65,2017-12-31,Velit est dolorem odit maxime iure. Amet veniam fuga illum. Ut quis dolore magnam sit. Perspiciatis quia sint corporis aut aut eos omnis quidem. Natus accusantium omnis omnis autem modi et fuga.,https://s3-us-west-1.amazonaws.com/hrfrontendcapstone/regular_4.png,https://s3-us-west-1.amazonaws.com/hrfrontendcapstone/1.jpeg
291,57,43,2018-10-20,Provident iusto eius labore totam sint hic numquam ut. Perspiciatis maxime repellendus ipsam possimus eos id impedit. Qui doloremque ipsam magni dolores sit veniam laudantium. Esse iusto excepturi aperiam. Voluptatem illo excepturi distinctio optio nisi iure ratione pariatur nobis. Laudantium quibusdam nostrum delectus cumque tenetur eum et asperiores.,https://s3-us-west-1.amazonaws.com/hrfrontendcapstone/regular_7.png,https://s3-us-west-1.amazonaws.com/hrfrontendcapstone/6.jpeg
292,99,89,2018-08-21,Eos sint sed aliquam deserunt sed saepe unde voluptas ab. Nihil eos aliquam laboriosam qui accusantium sunt voluptas. Rerum ratione libero voluptas fuga omnis dolore. Voluptatem tempora fuga nobis officiis ut maxime minus. Nam excepturi facilis.,https://s3-us-west-1.amazonaws.com/hrfrontendcapstone/regular_5.png,https://s3-us-west-1.amazonaws.com/hrfrontendcapstone/2.jpeg
293,85,13,2018-04-06,Voluptates maiores tempore mollitia quo eaque nulla. Excepturi facilis rem dolorem iusto et magnam. Et similique eum. Et repudiandae provident officiis omnis quisquam voluptatem recusandae et.,https://s3-us-west-1.amazonaws.com/hrfrontendcapstone/regular_7.png,https://s3-us-west-1.amazonaws.com/hrfrontendcapstone/2.jpeg
294,76,42,2018-05-17,Ut provident asperiores. Minus voluptatem non modi veniam quisquam eligendi iure illo omnis. Dolorem eum est doloribus necessitatibus.,https://s3-us-west-1.amazonaws.com/hrfrontendcapstone/regular_6.png,https://s3-us-west-1.amazonaws.com/hrfrontendcapstone/4.jpeg
