id,user_id,restaurant_id,date,review_comment,score,picture_food
735,61,33,2018-09-05,Consequatur officiis consequuntur. Omnis optio animi aperiam eos nam quisquam iste qui. Eum nostrum quae illum. Eos sapiente consectetur. Eveniet modi ut quia facere. Neque delectus maxime quod distinctio excepturi dicta recusandae a autem.,https://s3-us-west-1.amazonaws.com/hrfrontendcapstone/regular_3.png,https://s3-us-west-1.amazonaws.com/hrfrontendcapstone/4.jpeg
736,87,68,2018-05-07,Alias dolores quidem voluptatem voluptates quas. Velit repellendus vel aut unde molestiae soluta. Omnis et soluta nesciunt sit perspiciatis. Aliquid minus perferendis itaque fugit. Quod assumenda non aliquam ut cumque. Unde accusamus saepe minima dolorem.,https://s3-us-west-1.amazonaws.com/hrfrontendcapstone/regular_6.png,https://s3-us-west-1.amazonaws.com/hrfrontendcapstone/8.jpeg
737,21,8,2018-06-11,Enim labore et rem deserunt laudantium tenetur illum rerum. Sequi qui iure qui quas ut voluptatem aut repellendus. Odit eligendi sapiente et accusantium vitae recusandae. Eligendi qui iure sit. Quibusdam quidem nisi saepe quia ut ut deserunt.,https://s3-us-west-1.amazonaws.com/hrfrontendcapstone/regular_5.png,https://s3-us-west-1.amazonaws.com/hrfrontendcapstone/7.jpeg
738,21,58,2017-12-05,Quis sit ex atque est excepturi rerum ut deserunt. Sint voluptatem dolore autem perferendis ducimus dolorum non beatae vero. Qui nihil quae dolorem consequatur at ea dolor ex error.,https://s3-us-west-1.amazonaws.com/hrfrontendcapstone/regular_8.png,https://s3-us-west-1.amazonaws.com/hrfrontendcapstone/1.jpeg
739,93,9,2018-11-12,Dolor sunt ipsam laboriosam laboriosam asperiores et. Doloribus ea et qui totam inventore labore. Perferendis sint minus dicta aut blanditiis consequuntur recusandae. Est in dolorem repellendus magnam. Iste animi illo fuga ut.,https://s3-us-west-1.amazonaws.com/hrfrontendcapstone/regular_3.png,https://s3-us-west-1.amazonaws.com/hrfrontendcapstone/8.jpeg
740,45,39,2018-04-03,Corporis expedita reiciendis consequatur ea maxime aut eos. Nesciunt dicta repudiandae nesciunt quia fugit alias. Praesentium natus odio et sunt officiis debitis ad et. Natus eius ut porro sint ullam. Voluptatibus asperiores velit magni odit commodi.,https://s3-us-west-1.amazonaws.com/hrfrontendcapstone/regular_5.png,https://s3-us-west-1.amazonaws.com/hrfrontendcapstone/6.jpeg
741,44,23,2018-02-12,Non ab id sunt nostrum expedita quia est. Quibusdam ut alias ut autem enim quis. Magnam placeat velit voluptas ea laboriosam et deserunt vel.,https://s3-us-west-1.amazonaws.com/hrfrontendcapstone/regular_1.png,https://s3-us-west-1.amazonaws.com/hrfrontendcapstone/2.jpeg
742,93,82,2018-09-16,Enim fuga nobis quasi. Tempora aut tempora quaerat. Et enim blanditiis quis.,https://s3-us-west-1.amazonaws.com/hrfrontendcapstone/regular_5.png,https://s3-us-west-1.amazonaws.com/hrfrontendcapstone/8.jpeg
743,69,58,2017-12-07,Consequuntur voluptatum qui vitae nam maiores. Voluptatem mollitia quod ut alias distinctio sed quis. Voluptas saepe laborum similique repellendus voluptates non. Nobis id soluta.,https://s3-us-west-1.amazonaws.com/hrfrontendcapstone/regular_8.png,https://s3-us-west-1.amazonaws.com/hrfrontendcapstone/8.jpeg
744,93,71,2018-10-04,Cum voluptas totam. Dolores voluptatum et ea qui consequuntur. Esse aliquid labore sed accusamus. Eos rerum saepe temporibus numquam corrupti molestiae magni asperiores. Asperiores molestiae ipsa at officia eos voluptas. Nulla ipsum excepturi magnam mollitia facere sunt molestias.,https://s3-us-west-1.amazonaws.com/hrfrontendcapstone/regular_9.png,https://s3-us-west-1.amazonaws.com/hrfrontendcapstone/5.jpeg
745,91,1,2018-07-30,Sint et magni quos sed quod cum. Ex assumenda eveniet porro impedit ex et numquam. Natus iste minus qui aut excepturi sed itaque ipsa debitis. Non reprehenderit esse eum quo mollitia tenetur autem corporis est. Unde numquam ut laudantium aut. Aut rem asperiores necessitatibus earum dolores est.,https://s3-us-west-1.amazonaws.com/hrfrontendcapstone/regular_4.png,https://s3-us-west-1.amazonaws.com/hrfrontendcapstone/4.jpeg
746,67,64,2018-05-05,Eaque suscipit aut repellendus facilis consequuntur cumque libero sit assumenda. Qui esse cupiditate. Quas quo veritatis qui illo error quae aliquid nostrum. Voluptatem quia quia ut ducimus a nobis omnis quaerat. Molestiae et recusandae facere corrupti aut hic. Ut nobis hic voluptas qui ex voluptas saepe corporis error.,https://s3-us-west-1.amazonaws.com/hrfrontendcapstone/regular_3.png,https://s3-us-west-1.amazonaws.com/hrfrontendcapstone/7.jpeg
747,94,19,2018-08-18,Esse soluta consequuntur est odit tempora et amet illum. Vitae praesentium omnis aut exercitationem saepe officiis. Natus ex sapiente velit. Similique ipsa sed doloremque dolores qui sed voluptas. Ut officia in.,https://s3-us-west-1.amazonaws.com/hrfrontendcapstone/regular_3.png,https://s3-us-west-1.amazonaws.com/hrfrontendcapstone/8.jpeg
748,84,22,2018-02-08,Facere adipisci eaque reprehenderit. Consequuntur doloremque dolorem quo temporibus. Accusantium eligendi non vero enim et maiores odio.,https://s3-us-west-1.amazonaws.com/hrfrontendcapstone/regular_4.png,https://s3-us-west-1.amazonaws.com/hrfrontendcapstone/7.jpeg
749,92,8,2018-08-14,Impedit molestias harum autem dolor. Corporis enim laudantium velit provident labore. Perspiciatis modi unde rerum qui. Ut eaque perferendis voluptate voluptatum. Eligendi fuga et corrupti laudantium ratione ab.,https://s3-us-west-1.amazonaws.com/hrfrontendcapstone/regular_7.png,https://s3-us-west-1.amazonaws.com/hrfrontendcapstone/3.jpeg
750,14,77,2018-03-07,Error esse eveniet consequatur dolor molestiae soluta vero. Aliquid laboriosam quia. Error voluptatem cum unde quis est. Dolore nisi architecto et.,https://s3-us-west-1.amazonaws.com/hrfrontendcapstone/regular_6.png,https://s3-us-west-1.amazonaws.com/hrfrontendcapstone/2.jpeg
751,43,51,2017-11-21,Vitae sapiente tempore. Enim ab veritatis. Fugit deleniti odit quia magnam modi qui sint officia voluptas. Blanditiis soluta soluta. Laboriosam a autem.,https://s3-us-west-1.amazonaws.com/hrfrontendcapstone/regular_7.png,https://s3-us-west-1.amazonaws.com/hrfrontendcapstone/3.jpeg
752,48,74,2018-11-05,Non rem dignissimos omnis omnis expedita soluta molestias eligendi. Qui doloribus perferendis voluptas consectetur quidem sapiente. Quia ut assumenda.,https://s3-us-west-1.amazonaws.com/hrfrontendcapstone/regular_5.png,https://s3-us-west-1.amazonaws.com/hrfrontendcapstone/2.jpeg
753,45,63,2018-06-19,Nemo et quis minus voluptates. Hic laborum atque dignissimos eum aut. Enim ipsa similique quae suscipit omnis. Saepe libero ab sed quisquam praesentium modi veniam. Occaecati accusantium labore dignissimos voluptatem adipisci.,https://s3-us-west-1.amazonaws.com/hrfrontendcapstone/regular_9.png,https://s3-us-west-1.amazonaws.com/hrfrontendcapstone/2.jpeg
754,80,16,2018-03-18,Officia id repellat qui veniam voluptate repellat voluptatem autem dolores. Sit vel sapiente ratione error commodi est. Rerum dolores quod ipsa velit. Et id eligendi ut velit. Quos ducimus eveniet amet sit corporis iure voluptatibus. Quis recusandae est ratione illum qui.,https://s3-us-west-1.amazonaws.com/hrfrontendcapstone/regular_5.png,https://s3-us-west-1.amazonaws.com/hrfrontendcapstone/4.jpeg
755,92,21,2018-03-23,Ipsa culpa laudantium. Dolores eveniet et et eos explicabo nihil impedit. Delectus culpa maiores similique. Deleniti dignissimos consequatur architecto et vel ut quia. Numquam ratione aut dicta.,https://s3-us-west-1.amazonaws.com/hrfrontendcapstone/regular_1.png,https://s3-us-west-1.amazonaws.com/hrfrontendcapstone/5.jpeg
756,76,31,2018-09-13,Quia alias pariatur excepturi. Est voluptas voluptatem voluptas. Asperiores est eos officia at magnam voluptatem eveniet harum. Recusandae a ratione similique provident repellendus. Eum beatae rem quia neque rerum enim cumque. Voluptatem facilis veniam illum ab.,https://s3-us-west-1.amazonaws.com/hrfrontendcapstone/regular_3.png,https://s3-us-west-1.amazonaws.com/hrfrontendcapstone/4.jpeg
757,41,56,2018-07-07,Enim quasi autem temporibus. Deleniti sed asperiores possimus qui eos dolor aut. Est quia dolorem soluta similique et est fugiat voluptatibus deleniti. Sint soluta voluptatem accusamus id vel reiciendis. Dolorem accusamus a beatae nisi reprehenderit nisi sed.,https://s3-us-west-1.amazonaws.com/hrfrontendcapstone/regular_9.png,https://s3-us-west-1.amazonaws.com/hrfrontendcapstone/9.jpeg
758,50,33,2018-05-07,Sint assumenda explicabo earum architecto. Ipsa repellendus esse similique sed. Et iure et asperiores aut ipsa iusto beatae. Vel consequatur aut totam eum aspernatur qui. Fugit debitis sit.,https://s3-us-west-1.amazonaws.com/hrfrontendcapstone/regular_1.png,https://s3-us-west-1.amazonaws.com/hrfrontendcapstone/8.jpeg
759,18,75,2018-11-06,Et dignissimos temporibus perferendis consectetur occaecati eos odit. Iste ut cupiditate. Et explicabo repellendus aperiam corrupti consequatur ratione ad ipsa.,https://s3-us-west-1.amazonaws.com/hrfrontendcapstone/regular_7.png,https://s3-us-west-1.amazonaws.com/hrfrontendcapstone/5.jpeg
760,25,71,2018-08-25,Unde a rerum ut quia consequatur voluptate doloribus maiores. Iure qui laborum aliquam odit. Illum tempora rerum. Voluptatem consectetur perspiciatis cumque minus voluptas culpa inventore et.,https://s3-us-west-1.amazonaws.com/hrfrontendcapstone/regular_1.png,https://s3-us-west-1.amazonaws.com/hrfrontendcapstone/5.jpeg
761,84,83,2018-03-17,Accusantium sed earum a et et animi. Nisi sunt cumque facilis porro. Nesciunt optio natus ea voluptates. Laborum eligendi autem dignissimos minima dolore voluptas nemo quos. Possimus eos voluptatum magni aut architecto. Sed vitae aut sint amet aut ducimus dolorem esse.,https://s3-us-west-1.amazonaws.com/hrfrontendcapstone/regular_8.png,https://s3-us-west-1.amazonaws.com/hrfrontendcapstone/6.jpeg
762,5,13,2018-03-28,Perspiciatis velit eaque qui sed est qui quis et itaque. Est cum voluptatem fugiat aut ipsa omnis cupiditate. Quia ut accusantium mollitia dicta. Quibusdam non ut enim inventore animi sint rerum hic in.,https://s3-us-west-1.amazonaws.com/hrfrontendcapstone/regular_7.png,https://s3-us-west-1.amazonaws.com/hrfrontendcapstone/1.jpeg
763,72,56,2018-10-31,Velit cum unde iusto est ad qui non. Quibusdam nemo quisquam at et. Et ipsa repellat doloremque amet. Qui occaecati velit cupiditate. Expedita et ratione minus dolorem aut provident.,https://s3-us-west-1.amazonaws.com/hrfrontendcapstone/regular_2.png,https://s3-us-west-1.amazonaws.com/hrfrontendcapstone/2.jpeg
764,24,60,2018-05-25,Natus molestiae nobis. Rerum dolor officiis inventore ut et quasi. Cum est possimus nobis nam dicta dignissimos at esse laborum. Cumque animi reprehenderit libero. Blanditiis quo iure. Est inventore eos commodi suscipit quam voluptas qui provident dolor.,https://s3-us-west-1.amazonaws.com/hrfrontendcapstone/regular_4.png,https://s3-us-west-1.amazonaws.com/hrfrontendcapstone/3.jpeg
765,42,18,2018-06-26,Officiis beatae rem eveniet. Consectetur nobis rerum mollitia. Unde totam id ab.,https://s3-us-west-1.amazonaws.com/hrfrontendcapstone/regular_4.png,https://s3-us-west-1.amazonaws.com/hrfrontendcapstone/8.jpeg
766,95,88,2017-12-19,Voluptatem sequi consequatur nemo aut natus dolores suscipit id. Eum non voluptatem. Sunt asperiores excepturi incidunt dolore dolorem rerum.,https://s3-us-west-1.amazonaws.com/hrfrontendcapstone/regular_2.png,https://s3-us-west-1.amazonaws.com/hrfrontendcapstone/5.jpeg
767,54,67,2017-11-30,Ex temporibus consequatur consequatur natus. Non ad reprehenderit commodi vitae eaque perferendis. Odit laborum id sapiente et libero sapiente. Doloremque similique laudantium libero modi ipsam sit laudantium.,https://s3-us-west-1.amazonaws.com/hrfrontendcapstone/regular_1.png,https://s3-us-west-1.amazonaws.com/hrfrontendcapstone/1.jpeg
768,96,28,2018-08-21,Rem corporis sed in dolorum odit explicabo dolorum. Harum esse consequatur velit. Temporibus cupiditate non qui eius maiores at qui voluptatem adipisci. Ea iusto aut omnis velit illum reprehenderit distinctio. Error est in doloribus quaerat. Maiores similique iure ut ipsam a et.,https://s3-us-west-1.amazonaws.com/hrfrontendcapstone/regular_2.png,https://s3-us-west-1.amazonaws.com/hrfrontendcapstone/4.jpeg
769,57,24,2018-07-22,Dolorem rem quia. Mollitia et quae quia id qui eligendi ea provident quia. Repellendus architecto voluptates et pariatur iure autem perferendis alias rerum. Possimus officia magnam quia. Tenetur nam et sed.,https://s3-us-west-1.amazonaws.com/hrfrontendcapstone/regular_5.png,https://s3-us-west-1.amazonaws.com/hrfrontendcapstone/4.jpeg
770,17,43,2018-06-09,Rem aut tempora. Veritatis quisquam laboriosam dolor temporibus ea molestiae ut dolore. Similique sint blanditiis voluptas voluptate. Illo distinctio odit quisquam. Dolorem dolor vitae aut et voluptatem nostrum et sit.,https://s3-us-west-1.amazonaws.com/hrfrontendcapstone/regular_4.png,https://s3-us-west-1.amazonaws.com/hrfrontendcapstone/5.jpeg
771,78,1,2018-10-15,Ex quam consectetur tempora praesentium provident nesciunt. Facere consequuntur accusamus deserunt a aut. Ipsam ducimus sit aliquid enim excepturi sed quam laboriosam omnis. Officia iure dolore quo.,https://s3-us-west-1.amazonaws.com/hrfrontendcapstone/regular_8.png,https://s3-us-west-1.amazonaws.com/hrfrontendcapstone/1.jpeg
772,75,90,2018-07-05,Nihil necessitatibus occaecati distinctio alias quis. Non ea dolorum rerum accusamus quia aut quia. Ut ducimus minima laudantium vero magni. Alias soluta eos laboriosam nihil facilis est. Est voluptas hic dolor.,https://s3-us-west-1.amazonaws.com/hrfrontendcapstone/regular_8.png,https://s3-us-west-1.amazonaws.com/hrfrontendcapstone/5.jpeg
773,23,67,2017-12-05,Est perferendis vel quia nobis quam illum expedita temporibus soluta. Incidunt sint assumenda maiores non recusandae et recusandae. Veritatis omnis velit eum autem quis autem voluptates et. Autem soluta dolore adipisci unde ipsum odit. Beatae soluta atque alias quo sit voluptas voluptatem omnis voluptatem. Nihil iusto porro omnis excepturi pariatur sed consequatur sed.,https://s3-us-west-1.amazonaws.com/hrfrontendcapstone/regular_1.png,https://s3-us-west-1.amazonaws.com/hrfrontendcapstone/2.jpeg
774,23,73,2018-03-30,Voluptatum nisi fugit omnis nemo. Ratione iure at voluptate molestiae ut. Quae eaque quibusdam non consectetur culpa sit.,https://s3-us-west-1.amazonaws.com/hrfrontendcapstone/regular_7.png,https://s3-us-west-1.amazonaws.com/hrfrontendcapstone/8.jpeg
775,93,35,2018-03-28,Distinctio suscipit reiciendis ut et iste. Adipisci et cupiditate quas. Accusantium velit vero aliquid modi.,https://s3-us-west-1.amazonaws.com/hrfrontendcapstone/regular_8.png,https://s3-us-west-1.amazonaws.com/hrfrontendcapstone/7.jpeg
776,66,53,2018-11-09,Ex magni est non itaque sequi quo nisi culpa sed. Voluptate sed ut ut occaecati architecto harum. Alias repellat repellendus recusandae. Beatae in vel mollitia nam ea. Distinctio nesciunt id aut veniam neque aut laborum. Officia incidunt eos quia debitis voluptatum omnis alias dolores officia.,https://s3-us-west-1.amazonaws.com/hrfrontendcapstone/regular_4.png,https://s3-us-west-1.amazonaws.com/hrfrontendcapstone/1.jpeg
777,76,67,2017-12-23,Nesciunt nam est possimus ut omnis sed. Sint voluptatem ea est explicabo similique. Doloribus dignissimos qui aut dolorem. Vero facilis a ipsam. Laboriosam sit quia libero facere omnis perferendis minima qui.,https://s3-us-west-1.amazonaws.com/hrfrontendcapstone/regular_4.png,https://s3-us-west-1.amazonaws.com/hrfrontendcapstone/3.jpeg
778,86,63,2018-03-03,Sint atque omnis. Praesentium repellat molestias quia earum odit. Possimus voluptates eveniet voluptatem consequatur necessitatibus ipsum. Omnis et doloremque. Id debitis eum enim ipsam.,https://s3-us-west-1.amazonaws.com/hrfrontendcapstone/regular_9.png,https://s3-us-west-1.amazonaws.com/hrfrontendcapstone/7.jpeg
779,25,87,2018-07-17,Quaerat modi a veniam tenetur porro recusandae temporibus est. Sed rerum maxime doloremque qui quasi alias. Exercitationem perferendis soluta.,https://s3-us-west-1.amazonaws.com/hrfrontendcapstone/regular_4.png,https://s3-us-west-1.amazonaws.com/hrfrontendcapstone/3.jpeg
780,41,58,2018-05-23,Nostrum ipsam beatae adipisci tenetur. Sapiente laborum laborum sed qui id autem beatae. Quis ullam ut voluptatum suscipit qui voluptatum. Et et laudantium explicabo.,https://s3-us-west-1.amazonaws.com/hrfrontendcapstone/regular_9.png,https://s3-us-west-1.amazonaws.com/hrfrontendcapstone/3.jpeg
781,94,68,2017-11-18,Eum libero non et et ut ullam minus occaecati. Id praesentium corrupti eligendi voluptatibus deserunt veritatis atque molestiae. Voluptatem et aspernatur qui non aut dolores ipsa. Ut mollitia est nisi blanditiis atque incidunt facere placeat mollitia. Ea vitae soluta sunt quia qui nesciunt.,https://s3-us-west-1.amazonaws.com/hrfrontendcapstone/regular_8.png,https://s3-us-west-1.amazonaws.com/hrfrontendcapstone/9.jpeg
782,96,46,2018-02-07,Dolorem architecto in voluptas sed id necessitatibus. Culpa quia voluptas. Quis quam accusantium. Illum sapiente non sint sunt illo. Omnis quaerat sed voluptate quia aut maxime quam.,https://s3-us-west-1.amazonaws.com/hrfrontendcapstone/regular_2.png,https://s3-us-west-1.amazonaws.com/hrfrontendcapstone/4.jpeg
783,90,77,2018-09-16,Eligendi optio dolorum tempore cumque saepe eos qui. Eveniet et voluptatibus vitae dolorem sint quo. Sint sed perspiciatis nobis nihil ratione aspernatur molestiae consequatur et. Quis impedit dolorem consequatur quas illum.,https://s3-us-west-1.amazonaws.com/hrfrontendcapstone/regular_6.png,https://s3-us-west-1.amazonaws.com/hrfrontendcapstone/1.jpeg
784,50,64,2018-08-30,Id distinctio impedit itaque corporis amet molestiae. In doloribus optio enim debitis eos doloremque ut nisi rerum. Et voluptates in fuga nihil enim possimus consequatur incidunt omnis.,https://s3-us-west-1.amazonaws.com/hrfrontendcapstone/regular_9.png,https://s3-us-west-1.amazonaws.com/hrfrontendcapstone/3.jpeg
785,27,31,2018-10-15,Ullam ad qui aliquid. Odit voluptatem minus temporibus sit. Placeat excepturi labore ipsa est molestiae. Fuga velit ut quia autem.,https://s3-us-west-1.amazonaws.com/hrfrontendcapstone/regular_3.png,https://s3-us-west-1.amazonaws.com/hrfrontendcapstone/6.jpeg
786,18,45,2018-02-07,Autem ut molestiae nam cupiditate nihil esse fugit sint voluptatem. Ipsum ea eos unde earum assumenda dolores. Saepe et beatae quisquam. Aut qui voluptate quis dicta harum voluptatem soluta accusamus ut. Incidunt et ipsa. Quo est eveniet.,https://s3-us-west-1.amazonaws.com/hrfrontendcapstone/regular_6.png,https://s3-us-west-1.amazonaws.com/hrfrontendcapstone/8.jpeg
787,4,38,2018-10-27,Necessitatibus esse facilis voluptates maiores. Rerum occaecati nam itaque vero voluptates qui. Dolore velit praesentium harum voluptas voluptas est accusantium qui. Id ut voluptatem fugiat quis sed aut non voluptas. Necessitatibus non iste fugit deleniti repellat. Quod consequatur culpa aliquid.,https://s3-us-west-1.amazonaws.com/hrfrontendcapstone/regular_2.png,https://s3-us-west-1.amazonaws.com/hrfrontendcapstone/5.jpeg
788,91,51,2018-04-10,Voluptatibus commodi voluptas perferendis labore. Distinctio et quisquam non animi temporibus sunt occaecati. Libero quibusdam adipisci sunt dolor ratione aperiam. Voluptas nobis quam vero ex natus. Maiores architecto fugit ipsam ipsum.,https://s3-us-west-1.amazonaws.com/hrfrontendcapstone/regular_7.png,https://s3-us-west-1.amazonaws.com/hrfrontendcapstone/7.jpeg
789,56,47,2018-10-30,Cum voluptatum omnis voluptas libero. Sapiente nobis quia accusantium nihil iure distinctio. Voluptas veritatis quasi ratione eaque. Et omnis autem nisi aut ad animi dolores perferendis iusto. Velit aliquam aliquid corporis ea dolores deserunt molestiae dicta. Quo alias sed ut incidunt.,https://s3-us-west-1.amazonaws.com/hrfrontendcapstone/regular_2.png,https://s3-us-west-1.amazonaws.com/hrfrontendcapstone/9.jpeg
790,74,100,2018-02-09,Beatae in officia suscipit sunt est optio quos. Tempora ut voluptatem omnis. Recusandae voluptatem ut. Provident sed quis aspernatur iure voluptatum assumenda voluptas velit. Ad quis est rerum ut.,https://s3-us-west-1.amazonaws.com/hrfrontendcapstone/regular_4.png,https://s3-us-west-1.amazonaws.com/hrfrontendcapstone/3.jpeg
791,94,84,2017-12-15,Impedit inventore id earum nam culpa rerum et. Voluptatem quisquam corporis facere dolore ipsam architecto hic quae. Quia est reprehenderit reiciendis provident. Deleniti excepturi quibusdam voluptatum.,https://s3-us-west-1.amazonaws.com/hrfrontendcapstone/regular_2.png,https://s3-us-west-1.amazonaws.com/hrfrontendcapstone/2.jpeg
792,15,57,2018-02-17,Itaque numquam natus iste debitis voluptas accusantium repellendus deleniti unde. Nemo quae deserunt est est maxime facere error id. Dolorem quae est deleniti maiores corrupti et. Exercitationem consequatur qui quia cumque illo in vero doloribus voluptatum. Qui eaque enim repellat eos dolores ut.,https://s3-us-west-1.amazonaws.com/hrfrontendcapstone/regular_2.png,https://s3-us-west-1.amazonaws.com/hrfrontendcapstone/7.jpeg
793,82,29,2018-11-01,Nihil dicta sit iste corrupti dolorem accusamus dolores. Placeat porro at nobis quis rerum facere eum. Commodi nulla adipisci autem quisquam consequuntur sed eveniet sed. Suscipit qui libero nostrum. Eum quo unde optio aut quibusdam architecto vel. Non magnam est est debitis voluptatem dolor adipisci sit.,https://s3-us-west-1.amazonaws.com/hrfrontendcapstone/regular_9.png,https://s3-us-west-1.amazonaws.com/hrfrontendcapstone/9.jpeg
794,26,72,2017-12-04,Quidem suscipit quaerat deleniti qui aut est omnis cumque. Laudantium possimus ut necessitatibus cupiditate id ipsam nobis ipsam. Aspernatur corrupti similique placeat quos nobis. Ut eligendi sint vel debitis. Quia delectus praesentium ea quam repellat.,https://s3-us-west-1.amazonaws.com/hrfrontendcapstone/regular_4.png,https://s3-us-west-1.amazonaws.com/hrfrontendcapstone/2.jpeg
795,9,82,2018-03-30,Aut quia voluptatem temporibus vitae natus consequuntur. Ut voluptate esse quia consequuntur aut. Totam sunt ullam porro voluptatum eligendi recusandae qui eaque veritatis.,https://s3-us-west-1.amazonaws.com/hrfrontendcapstone/regular_6.png,https://s3-us-west-1.amazonaws.com/hrfrontendcapstone/9.jpeg
796,14,7,2018-07-10,Non neque minima eius unde. Voluptas accusantium reprehenderit quod ipsam natus non qui. Nobis dolores mollitia ducimus et rem dolor.,https://s3-us-west-1.amazonaws.com/hrfrontendcapstone/regular_4.png,https://s3-us-west-1.amazonaws.com/hrfrontendcapstone/3.jpeg
797,48,40,2018-01-05,Consequatur magnam harum. Dolorem aspernatur quibusdam vero velit corrupti. Beatae neque eveniet ipsam saepe esse. Qui tempore labore animi sed.,https://s3-us-west-1.amazonaws.com/hrfrontendcapstone/regular_7.png,https://s3-us-west-1.amazonaws.com/hrfrontendcapstone/3.jpeg
798,83,6,2018-03-16,Illum est architecto mollitia perferendis qui atque illum dolores animi. Vero voluptates ipsum nostrum possimus culpa culpa in qui debitis. Quis error dolores error.,https://s3-us-west-1.amazonaws.com/hrfrontendcapstone/regular_8.png,https://s3-us-west-1.amazonaws.com/hrfrontendcapstone/9.jpeg
799,3,55,2018-07-12,Recusandae et neque. Sit aliquam officia est repudiandae. Consequatur rerum commodi. Hic aliquam natus aliquid. Dolorem enim earum atque nam odio harum est.,https://s3-us-west-1.amazonaws.com/hrfrontendcapstone/regular_6.png,https://s3-us-west-1.amazonaws.com/hrfrontendcapstone/8.jpeg
800,18,54,2018-11-03,Ut nesciunt non. Autem temporibus voluptatem. Voluptatem quam quam id numquam hic cupiditate et aperiam. Quae molestiae illum fugiat et qui ut voluptas rerum necessitatibus. Recusandae ad eveniet incidunt et.,https://s3-us-west-1.amazonaws.com/hrfrontendcapstone/regular_6.png,https://s3-us-west-1.amazonaws.com/hrfrontendcapstone/4.jpeg
801,9,12,2018-07-15,Ea voluptates enim odio pariatur laudantium cumque qui. Nam qui nulla sit fuga vitae. Enim cumque incidunt est. Libero qui cum sunt quidem voluptatem consequatur modi quam labore. Quia provident voluptatem non ea quia. Nihil magnam quod consequatur consequuntur commodi.,https://s3-us-west-1.amazonaws.com/hrfrontendcapstone/regular_6.png,https://s3-us-west-1.amazonaws.com/hrfrontendcapstone/6.jpeg
802,93,86,2018-04-08,Occaecati perspiciatis et et expedita fugit delectus voluptas aut. Reprehenderit eligendi alias vitae quo ea. Rerum dolores possimus consequatur unde. Nam inventore facilis et dolorem autem et et asperiores eveniet. Rerum impedit earum dignissimos unde aliquid totam. Maiores quas soluta nam tenetur corrupti velit.,https://s3-us-west-1.amazonaws.com/hrfrontendcapstone/regular_1.png,https://s3-us-west-1.amazonaws.com/hrfrontendcapstone/4.jpeg
803,26,94,2018-05-15,Maxime corporis cumque et. Quod molestiae harum odit. Ut consequatur unde. Labore voluptatem natus nesciunt porro voluptatem et aut sint. Et vitae et esse laborum unde consequatur consequatur aut. Qui libero ipsam nihil.,https://s3-us-west-1.amazonaws.com/hrfrontendcapstone/regular_8.png,https://s3-us-west-1.amazonaws.com/hrfrontendcapstone/6.jpeg
804,64,48,2018-08-20,Corporis commodi rerum. Sed hic maxime est sequi saepe ut aspernatur. Reiciendis natus sed eligendi et qui veniam. A laudantium enim doloribus cumque eaque ut. Qui nihil placeat aperiam veritatis vel ratione ut ea ratione. Commodi eveniet adipisci quae eum sit soluta laboriosam maiores quas.,https://s3-us-west-1.amazonaws.com/hrfrontendcapstone/regular_6.png,https://s3-us-west-1.amazonaws.com/hrfrontendcapstone/3.jpeg
805,64,80,2018-09-07,Maiores delectus quidem sed facere inventore quia atque dolor. Laboriosam maiores voluptatibus est. Soluta expedita voluptatem minima in omnis asperiores quisquam eveniet.,https://s3-us-west-1.amazonaws.com/hrfrontendcapstone/regular_6.png,https://s3-us-west-1.amazonaws.com/hrfrontendcapstone/6.jpeg
