id,user_id,restaurant_id,date,review_comment,score,picture_food
1,26,20,2018-08-04,Voluptates non fuga facilis. Quis totam corporis magni quis neque. Natus magni quia soluta occaecati sequi sit iure. Aliquid ex molestiae laborum aut veniam repudiandae maxime impedit. A occaecati ut fugiat aliquid qui.,https://s3-us-west-1.amazonaws.com/hrfrontendcapstone/regular_3.png,https://s3-us-west-1.amazonaws.com/hrfrontendcapstone/2.jpeg
2,95,13,2018-09-05,Ullam veniam voluptatem molestiae aut. Iste quasi rerum eum numquam suscipit dolor reiciendis accusantium. Ipsa sit aut placeat sit sequi a. Sequi cupiditate hic quia totam id accusantium eaque adipisci.,https://s3-us-west-1.amazonaws.com/hrfrontendcapstone/regular_8.png,https://s3-us-west-1.amazonaws.com/hrfrontendcapstone/2.jpeg
3,95,81,2018-09-02,Blanditiis corporis voluptatem. Nulla itaque aut nam tempora quo ut quae. Eveniet dicta alias amet consequuntur et corrupti autem. Voluptatem ullam sapiente commodi. Quia tempore quam esse et expedita.,https://s3-us-west-1.amazonaws.com/hrfrontendcapstone/regular_4.png,https://s3-us-west-1.amazonaws.com/hrfrontendcapstone/4.jpeg
4,23,76,2018-02-28,Est facere eum. Ut modi consectetur hic id laboriosam. Commodi reprehenderit labore quasi vitae cumque velit.,https://s3-us-west-1.amazonaws.com/hrfrontendcapstone/regular_4.png,https://s3-us-west-1.amazonaws.com/hrfrontendcapstone/5.jpeg
5,46,71,2018-11-04,A et aperiam consequatur tenetur quibusdam quidem dicta ad. Cupiditate praesentium voluptatem maiores sed vero pariatur rerum ipsam et. Iusto officiis quas quo est omnis eos. Cum et quia odio vel. Voluptas totam est fugit. Quasi sint assumenda eum consequatur quos.,https://s3-us-west-1.amazonaws.com/hrfrontendcapstone/regular_5.png,https://s3-us-west-1.amazonaws.com/hrfrontendcapstone/7.jpeg
6,3,20,2018-07-23,Quos rerum autem deleniti sed harum voluptas non enim. Eaque aut quam voluptas quam voluptatem dolor non fuga. Dolore in nam itaque voluptatem eius. Sunt eos est. Quis vel repellat quia.,https://s3-us-west-1.amazonaws.com/hrfrontendcapstone/regular_9.png,https://s3-us-west-1.amazonaws.com/hrfrontendcapstone/4.jpeg
7,95,92,2017-12-14,Vel amet excepturi ea aut doloribus. Aliquid soluta nulla et nesciunt aliquam. Asperiores ab aut. Dolorum nam ut.,https://s3-us-west-1.amazonaws.com/hrfrontendcapstone/regular_7.png,https://s3-us-west-1.amazonaws.com/hrfrontendcapstone/5.jpeg
8,85,51,2018-09-17,Qui ut excepturi repellat. Rem ipsa fuga harum sit laudantium voluptates nesciunt. Consequuntur aut odio distinctio harum sit.,https://s3-us-west-1.amazonaws.com/hrfrontendcapstone/regular_9.png,https://s3-us-west-1.amazonaws.com/hrfrontendcapstone/6.jpeg
9,93,15,2018-03-21,Sunt sed saepe neque et nulla. Nihil cumque recusandae earum ut quo provident in omnis. Ex doloribus iste laborum temporibus. Beatae maiores nisi aliquam sit. Laboriosam autem sapiente suscipit sunt quaerat. Minima in nobis.,https://s3-us-west-1.amazonaws.com/hrfrontendcapstone/regular_3.png,https://s3-us-west-1.amazonaws.com/hrfrontendcapstone/1.jpeg
10,17,86,2018-05-11,Praesentium illum et molestiae corporis et eius et. Rerum laborum assumenda. Harum est pariatur minima vero ratione porro. Molestiae non ut assumenda eligendi ea eveniet minus.,https://s3-us-west-1.amazonaws.com/hrfrontendcapstone/regular_1.png,https://s3-us-west-1.amazonaws.com/hrfrontendcapstone/7.jpeg
11,48,12,2018-07-12,Sapiente vero quam accusantium totam fugit dolores quibusdam dolor omnis. At vel nemo ipsam voluptatem sed. Fugit quis quo magnam nobis enim. Accusamus tempora earum sit eius velit. Maiores non aut iusto voluptatem omnis sed sed. Dolor esse deserunt accusamus quia.,https://s3-us-west-1.amazonaws.com/hrfrontendcapstone/regular_8.png,https://s3-us-west-1.amazonaws.com/hrfrontendcapstone/4.jpeg
12,53,85,2018-04-05,Nostrum vel facilis et tempore eius et provident architecto. Aliquam ducimus officiis nostrum nostrum rerum ipsum. Minima ipsa animi molestiae non ullam enim commodi. Vel deserunt dolorum harum enim facere sint. Similique esse minima dolor dolore. Accusamus sapiente optio doloremque fugiat voluptatem ab.,https://s3-us-west-1.amazonaws.com/hrfrontendcapstone/regular_5.png,https://s3-us-west-1.amazonaws.com/hrfrontendcapstone/7.jpeg
13,90,22,2017-12-11,Et perspiciatis suscipit eius aut modi consequatur alias. Consequatur eligendi et. Repellat consectetur ab optio qui porro facere accusamus. Odio pariatur modi ut delectus at. Quis ut pariatur commodi nemo a corrupti maiores. Quia voluptatem maiores cupiditate enim animi ipsa ut labore.,https://s3-us-west-1.amazonaws.com/hrfrontendcapstone/regular_9.png,https://s3-us-west-1.amazonaws.com/hrfrontendcapstone/4.jpeg
14,94,42,2018-01-26,Doloremque voluptas rem quo ut non culpa enim impedit rem. Occaecati voluptatibus culpa itaque. Eaque recusandae dolor fuga hic est iusto. Nihil voluptate omnis voluptatem saepe est sunt dolores.,https://s3-us-west-1.amazonaws.com/hrfrontendcapstone/regular_9.png,https://s3-us-west-1.amazonaws.com/hrfrontendcapstone/1.jpeg
15,19,79,2018-02-22,Quia reprehenderit explicabo et voluptas itaque minus expedita. Consequatur rerum quis exercitationem eos sunt quis. Dignissimos doloremque eveniet quidem. Eos nesciunt sed. Perferendis non et soluta voluptatem est cumque dolores distinctio corporis. At maiores ea esse corrupti.,https://s3-us-west-1.amazonaws.com/hrfrontendcapstone/regular_1.png,https://s3-us-west-1.amazonaws.com/hrfrontendcapstone/1.jpeg
16,87,1,2018-08-03,Distinctio sit recusandae quae quia aliquam ipsam voluptatem praesentium. Sit enim ipsum sunt. Adipisci adipisci qui dolor. Libero esse esse aut.,https://s3-us-west-1.amazonaws.com/hrfrontendcapstone/regular_2.png,https://s3-us-west-1.amazonaws.com/hrfrontendcapstone/8.jpeg
17,44,50,2017-12-09,Amet quam vel earum alias eos hic aut doloribus et. At ut amet et quisquam. Omnis molestiae autem nihil excepturi alias eum provident quia porro. Saepe quibusdam voluptatum quis rerum natus repudiandae inventore deleniti culpa. Et ipsum ab est.,https://s3-us-west-1.amazonaws.com/hrfrontendcapstone/regular_6.png,https://s3-us-west-1.amazonaws.com/hrfrontendcapstone/6.jpeg
18,14,19,2018-01-01,Expedita et dicta laboriosam. Libero ab maxime magnam. Cupiditate nobis repellendus veniam. Itaque excepturi magnam porro in corporis modi mollitia quibusdam.,https://s3-us-west-1.amazonaws.com/hrfrontendcapstone/regular_3.png,https://s3-us-west-1.amazonaws.com/hrfrontendcapstone/4.jpeg
19,29,72,2017-11-17,Maxime placeat in rerum ut autem eos at id. Aut et voluptatum facere nulla. Recusandae est cum tempore. Enim id doloribus voluptatem reprehenderit numquam repellendus.,https://s3-us-west-1.amazonaws.com/hrfrontendcapstone/regular_4.png,https://s3-us-west-1.amazonaws.com/hrfrontendcapstone/6.jpeg
20,13,17,2018-02-18,Enim at quia et quia earum vel cumque corporis. Ut harum facere modi deleniti. Ab soluta omnis omnis dolores atque. Quisquam quis qui facere porro ea minima est ipsa. Voluptate qui velit cupiditate labore sunt velit corrupti.,https://s3-us-west-1.amazonaws.com/hrfrontendcapstone/regular_5.png,https://s3-us-west-1.amazonaws.com/hrfrontendcapstone/4.jpeg
21,70,30,2018-07-08,Sunt sequi magni sint. Cupiditate at doloremque eos est. Et qui quo sunt incidunt. Impedit sit omnis officiis. Consequatur voluptatem harum tempora soluta voluptas consequatur.,https://s3-us-west-1.amazonaws.com/hrfrontendcapstone/regular_9.png,https://s3-us-west-1.amazonaws.com/hrfrontendcapstone/2.jpeg
22,22,95,2018-05-20,Molestiae et sequi ut occaecati eveniet est illum. Quae quidem nihil aliquam. Laudantium veritatis incidunt praesentium recusandae adipisci tenetur recusandae eligendi maiores. Doloremque occaecati assumenda corrupti inventore ea sint in.,https://s3-us-west-1.amazonaws.com/hrfrontendcapstone/regular_2.png,https://s3-us-west-1.amazonaws.com/hrfrontendcapstone/7.jpeg
23,27,17,2018-10-19,Voluptatibus repellendus reiciendis non facilis similique. Voluptas reprehenderit atque voluptas. Totam quis magnam ab laudantium soluta corporis numquam. Sint consectetur corrupti. Neque consectetur est.,https://s3-us-west-1.amazonaws.com/hrfrontendcapstone/regular_8.png,https://s3-us-west-1.amazonaws.com/hrfrontendcapstone/8.jpeg
24,54,54,2018-06-26,Velit magni et. Ratione dolorum voluptas tenetur temporibus pariatur. Ullam quae id ipsum molestiae.,https://s3-us-west-1.amazonaws.com/hrfrontendcapstone/regular_7.png,https://s3-us-west-1.amazonaws.com/hrfrontendcapstone/4.jpeg
25,85,37,2018-08-04,Adipisci repellat voluptas nam quia. Id sed molestias magni odit. Et voluptatem architecto et quos. Fugiat tenetur praesentium architecto explicabo id iure quidem ad quo.,https://s3-us-west-1.amazonaws.com/hrfrontendcapstone/regular_6.png,https://s3-us-west-1.amazonaws.com/hrfrontendcapstone/6.jpeg
26,88,41,2018-05-03,Labore maiores illum aperiam vel omnis adipisci qui iusto facere. Iste illum repellat. Hic omnis veritatis doloribus blanditiis et. Praesentium quos voluptate ut impedit itaque magni atque dolorum voluptatum. Fugit natus sit.,https://s3-us-west-1.amazonaws.com/hrfrontendcapstone/regular_3.png,https://s3-us-west-1.amazonaws.com/hrfrontendcapstone/3.jpeg
27,96,78,2018-04-30,Debitis eaque et ut qui tempora officia dolore dolorem explicabo. Est eveniet repellat explicabo officia rem sed aliquid. Tempore dolorum quasi. Repudiandae a in eveniet iure quo beatae. Ut aperiam voluptate fuga esse et. Eaque fugiat repellendus ex.,https://s3-us-west-1.amazonaws.com/hrfrontendcapstone/regular_2.png,https://s3-us-west-1.amazonaws.com/hrfrontendcapstone/1.jpeg
28,24,45,2018-01-13,Fuga molestiae sunt dicta. Non est et odio unde quas provident occaecati aperiam. Veritatis dicta eos sit quis voluptatem. Voluptatem quo minima itaque temporibus ipsa voluptatum enim dignissimos qui. Illo nihil iure.,https://s3-us-west-1.amazonaws.com/hrfrontendcapstone/regular_6.png,https://s3-us-west-1.amazonaws.com/hrfrontendcapstone/5.jpeg
29,34,92,2018-10-20,Veniam architecto qui ea cupiditate et inventore. Repellendus consequuntur iste iure. Et ipsam est magni occaecati quae omnis facere. Ut sunt tempore rerum sit possimus commodi.,https://s3-us-west-1.amazonaws.com/hrfrontendcapstone/regular_9.png,https://s3-us-west-1.amazonaws.com/hrfrontendcapstone/9.jpeg
30,86,81,2018-07-04,Id est est magnam cum hic distinctio voluptatem inventore nam. Doloribus vel aut odit esse. Ipsum aut veritatis dolor eos omnis deserunt quo libero. Porro quibusdam facere. Officia eum iusto labore ab ut rerum.,https://s3-us-west-1.amazonaws.com/hrfrontendcapstone/regular_2.png,https://s3-us-west-1.amazonaws.com/hrfrontendcapstone/9.jpeg
31,36,16,2018-02-11,Repudiandae et libero ipsum. Omnis quam magni totam. Praesentium rerum quaerat velit eum deleniti non. Odit qui aut. Asperiores architecto est tempore blanditiis consectetur ut veniam.,https://s3-us-west-1.amazonaws.com/hrfrontendcapstone/regular_4.png,https://s3-us-west-1.amazonaws.com/hrfrontendcapstone/1.jpeg
32,35,82,2018-04-26,Et commodi odit. Quasi quos omnis modi nesciunt. Velit autem iure ipsa id dicta dolores facilis maxime ea. Voluptatem voluptatibus cupiditate doloremque voluptas facilis vitae impedit. Odit neque odit ab sint earum unde. Et consequatur magni corporis omnis sit.,https://s3-us-west-1.amazonaws.com/hrfrontendcapstone/regular_4.png,https://s3-us-west-1.amazonaws.com/hrfrontendcapstone/9.jpeg
33,79,53,2018-09-20,Itaque asperiores sed natus ad reiciendis rerum totam. Et et vitae dolorum ab quaerat. Ullam quia reiciendis minus. Labore ex maiores facere.,https://s3-us-west-1.amazonaws.com/hrfrontendcapstone/regular_4.png,https://s3-us-west-1.amazonaws.com/hrfrontendcapstone/2.jpeg
34,13,59,2018-05-27,Qui dolor sit tempora recusandae ducimus voluptatem. Rerum eligendi quisquam temporibus fuga. Ut amet cupiditate quaerat placeat dignissimos est sed. Dolorem deserunt harum quisquam beatae et molestiae. Blanditiis aut et veniam.,https://s3-us-west-1.amazonaws.com/hrfrontendcapstone/regular_4.png,https://s3-us-west-1.amazonaws.com/hrfrontendcapstone/9.jpeg
35,70,63,2018-05-21,Asperiores qui eum vel. Voluptate optio quia amet et tempore quidem natus impedit dignissimos. Ipsam repudiandae impedit quasi quis vitae velit iste. Reiciendis velit et sed ab. Placeat deleniti voluptates maiores vero veniam.,https://s3-us-west-1.amazonaws.com/hrfrontendcapstone/regular_9.png,https://s3-us-west-1.amazonaws.com/hrfrontendcapstone/9.jpeg
36,5,36,2018-08-16,Qui ut facere quaerat aliquam similique rerum voluptas ad. Quibusdam doloremque iusto est fugiat est sapiente quaerat et quidem. Labore velit sed in error magnam eos aut. Tempore suscipit aut veniam.,https://s3-us-west-1.amazonaws.com/hrfrontendcapstone/regular_7.png,https://s3-us-west-1.amazonaws.com/hrfrontendcapstone/3.jpeg
37,28,88,2018-02-13,Et neque necessitatibus. Sit animi id aut. Nostrum ut vitae sunt facere. Quam numquam deserunt repellendus eos harum a ut culpa. Deleniti quis sunt et.,https://s3-us-west-1.amazonaws.com/hrfrontendcapstone/regular_2.png,https://s3-us-west-1.amazonaws.com/hrfrontendcapstone/9.jpeg
38,54,100,2018-03-23,Suscipit vitae fuga libero quo cumque laborum et. Modi incidunt quidem sunt ipsam. Explicabo ducimus cum. Cupiditate repellendus fugit est sequi.,https://s3-us-west-1.amazonaws.com/hrfrontendcapstone/regular_9.png,https://s3-us-west-1.amazonaws.com/hrfrontendcapstone/3.jpeg
39,22,55,2018-07-22,Qui in itaque at eum id quisquam veniam sequi. Et fugiat repudiandae similique illo ratione esse totam. In veniam necessitatibus cumque consectetur numquam necessitatibus consectetur voluptatibus. Architecto fugit laboriosam eligendi reiciendis et aut impedit tempore. Possimus iusto eveniet est sit assumenda.,https://s3-us-west-1.amazonaws.com/hrfrontendcapstone/regular_6.png,https://s3-us-west-1.amazonaws.com/hrfrontendcapstone/3.jpeg
40,43,92,2018-11-10,Quas a est. Aliquam qui sunt placeat in aperiam ullam iure et. Et similique explicabo.,https://s3-us-west-1.amazonaws.com/hrfrontendcapstone/regular_4.png,https://s3-us-west-1.amazonaws.com/hrfrontendcapstone/3.jpeg
41,46,40,2018-11-01,Nulla rerum nulla nesciunt consequatur ut dolores possimus aut. Blanditiis expedita corporis deserunt ipsa. Tempora quam quas ut repellat nam ipsam excepturi. Velit vitae ea excepturi vitae reprehenderit omnis.,https://s3-us-west-1.amazonaws.com/hrfrontendcapstone/regular_7.png,https://s3-us-west-1.amazonaws.com/hrfrontendcapstone/8.jpeg
42,35,78,2018-08-10,Non soluta repudiandae voluptatem. Dolorem nisi architecto nesciunt error non blanditiis est aut. Et dolorum dolore corporis. Quaerat reprehenderit minima fuga illo commodi.,https://s3-us-west-1.amazonaws.com/hrfrontendcapstone/regular_1.png,https://s3-us-west-1.amazonaws.com/hrfrontendcapstone/8.jpeg
43,31,38,2018-04-08,Nesciunt dolores ducimus ad ut modi reiciendis et enim temporibus. Magni explicabo autem id. Deleniti pariatur numquam itaque. Quis reprehenderit et modi nulla perspiciatis eius maxime eius. Vel commodi quia sit vel.,https://s3-us-west-1.amazonaws.com/hrfrontendcapstone/regular_8.png,https://s3-us-west-1.amazonaws.com/hrfrontendcapstone/7.jpeg
44,3,42,2018-03-03,Officiis porro rerum non nobis et. Harum sed non et omnis soluta vel aut est totam. Maiores deleniti molestias. Magnam voluptas quaerat voluptatem qui soluta fuga ex quae reprehenderit.,https://s3-us-west-1.amazonaws.com/hrfrontendcapstone/regular_9.png,https://s3-us-west-1.amazonaws.com/hrfrontendcapstone/6.jpeg
45,10,35,2018-07-20,Ea et fugiat est repellendus dolorum corrupti dolor. Placeat illo quo consequatur. Mollitia sed voluptas autem. Quo nihil iusto ipsam sint reiciendis.,https://s3-us-west-1.amazonaws.com/hrfrontendcapstone/regular_6.png,https://s3-us-west-1.amazonaws.com/hrfrontendcapstone/3.jpeg
46,26,31,2018-05-10,Nihil necessitatibus non ipsum nesciunt consequatur commodi ducimus veniam quisquam. Dignissimos vero veniam hic. Est vel est rerum veniam repudiandae assumenda.,https://s3-us-west-1.amazonaws.com/hrfrontendcapstone/regular_5.png,https://s3-us-west-1.amazonaws.com/hrfrontendcapstone/3.jpeg
47,3,59,2017-12-15,Dicta ea natus consectetur consequatur sint vitae. Ad earum pariatur ut at. Ex quis veniam nesciunt delectus accusantium voluptatum minima rerum molestiae.,https://s3-us-west-1.amazonaws.com/hrfrontendcapstone/regular_4.png,https://s3-us-west-1.amazonaws.com/hrfrontendcapstone/6.jpeg
48,77,61,2018-03-23,Vel et voluptas eos nisi aperiam optio expedita. Quos nisi necessitatibus laudantium assumenda est deleniti est libero. Deserunt facere ut rem possimus tempora voluptatem odio quam. Incidunt autem cupiditate labore consequatur omnis temporibus.,https://s3-us-west-1.amazonaws.com/hrfrontendcapstone/regular_2.png,https://s3-us-west-1.amazonaws.com/hrfrontendcapstone/7.jpeg
49,74,30,2018-04-03,Nam ullam molestiae eum dolore distinctio. Perferendis ipsum explicabo. Repellendus dolor voluptates sint aspernatur et vel aut ea omnis. Occaecati at corporis. Temporibus in accusamus voluptatibus quos.,https://s3-us-west-1.amazonaws.com/hrfrontendcapstone/regular_2.png,https://s3-us-west-1.amazonaws.com/hrfrontendcapstone/4.jpeg
50,90,87,2018-03-03,Eos quia aliquid quas iste vel aut cum consequatur perspiciatis. Nisi eligendi autem fugiat error. Facere iure dolor est minima doloribus explicabo. Dolorem vel dolores amet fugit quia voluptatem. Porro voluptas maiores blanditiis numquam. Dolores rerum ratione voluptatem aut sapiente quis.,https://s3-us-west-1.amazonaws.com/hrfrontendcapstone/regular_1.png,https://s3-us-west-1.amazonaws.com/hrfrontendcapstone/7.jpeg
51,18,84,2018-09-07,Quia ut omnis ex at autem et assumenda omnis. Eaque nostrum et id voluptatibus et asperiores et iure. Ad hic aut recusandae. In dolorem non.,https://s3-us-west-1.amazonaws.com/hrfrontendcapstone/regular_3.png,https://s3-us-west-1.amazonaws.com/hrfrontendcapstone/2.jpeg
52,20,4,2018-06-24,Magnam asperiores dignissimos alias earum corporis. Aut non error illum. Deleniti adipisci nisi sunt id non autem. Fugiat rem autem sit. Ea dolores earum itaque et hic occaecati sit vel quae.,https://s3-us-west-1.amazonaws.com/hrfrontendcapstone/regular_7.png,https://s3-us-west-1.amazonaws.com/hrfrontendcapstone/9.jpeg
53,54,87,2018-06-10,Cupiditate voluptate cum perferendis qui culpa. Numquam sit voluptas excepturi nulla odio in officia. Est officia eaque voluptas molestias blanditiis error cum neque. Et amet doloremque ut. Laborum voluptas numquam eos magni quidem quaerat.,https://s3-us-west-1.amazonaws.com/hrfrontendcapstone/regular_2.png,https://s3-us-west-1.amazonaws.com/hrfrontendcapstone/4.jpeg
54,15,85,2018-02-07,Et vero explicabo. Eum dignissimos harum. Voluptate repellat rem.,https://s3-us-west-1.amazonaws.com/hrfrontendcapstone/regular_9.png,https://s3-us-west-1.amazonaws.com/hrfrontendcapstone/3.jpeg
55,3,4,2018-11-10,Consequatur praesentium est totam aut reprehenderit iure et ut possimus. Ad eius sed quod aut esse non. Rem laboriosam perspiciatis quia tempore.,https://s3-us-west-1.amazonaws.com/hrfrontendcapstone/regular_4.png,https://s3-us-west-1.amazonaws.com/hrfrontendcapstone/2.jpeg
56,70,51,2018-10-31,Vero vitae ut illo repellendus itaque. Maiores voluptatem sint dolores rerum. Enim est perspiciatis est.,https://s3-us-west-1.amazonaws.com/hrfrontendcapstone/regular_6.png,https://s3-us-west-1.amazonaws.com/hrfrontendcapstone/6.jpeg
57,17,14,2018-05-24,Voluptatem exercitationem illum vel minima magnam ut. Ut eaque dicta ut sed tenetur commodi ratione. Quam quas voluptates facere. Voluptate et accusantium architecto quasi accusamus cupiditate deleniti. Ipsa et corporis recusandae aut repellendus eos placeat qui.,https://s3-us-west-1.amazonaws.com/hrfrontendcapstone/regular_2.png,https://s3-us-west-1.amazonaws.com/hrfrontendcapstone/5.jpeg
58,15,30,2018-09-13,Voluptatibus cum nesciunt eveniet maiores fugit inventore. Quia et iste voluptatem voluptatum. Sequi ut totam in et. Itaque porro exercitationem voluptate sint dolore dolorem eveniet eos illo.,https://s3-us-west-1.amazonaws.com/hrfrontendcapstone/regular_2.png,https://s3-us-west-1.amazonaws.com/hrfrontendcapstone/3.jpeg
59,71,31,2018-10-22,Quis corrupti officia reprehenderit. Quo porro quibusdam aut quidem eaque facere ut et accusantium. Autem et praesentium magnam molestiae aliquid velit sequi sit. Exercitationem est rem ipsum voluptates et.,https://s3-us-west-1.amazonaws.com/hrfrontendcapstone/regular_4.png,https://s3-us-west-1.amazonaws.com/hrfrontendcapstone/6.jpeg
60,95,51,2018-01-27,Inventore repellendus placeat et quod est ut maxime sunt. Necessitatibus et atque rerum sapiente explicabo accusantium sint incidunt commodi. Nobis quia in minus pariatur commodi non voluptates.,https://s3-us-west-1.amazonaws.com/hrfrontendcapstone/regular_8.png,https://s3-us-west-1.amazonaws.com/hrfrontendcapstone/5.jpeg
61,88,77,2018-02-17,Reprehenderit deleniti voluptas voluptatibus facere reprehenderit. Sapiente vero atque neque officiis voluptas est ut doloribus. Dolorum tempore illo expedita nulla non.,https://s3-us-west-1.amazonaws.com/hrfrontendcapstone/regular_1.png,https://s3-us-west-1.amazonaws.com/hrfrontendcapstone/2.jpeg
62,18,15,2018-09-21,Atque natus sequi. Mollitia voluptatibus molestias. Voluptatum et quod facilis eveniet quo illo vitae.,https://s3-us-west-1.amazonaws.com/hrfrontendcapstone/regular_3.png,https://s3-us-west-1.amazonaws.com/hrfrontendcapstone/4.jpeg
63,56,63,2018-02-10,Accusamus quibusdam ea quod molestiae veritatis. Aut dolorem dicta architecto suscipit vero. Voluptates vitae harum voluptas qui dolorem quisquam quisquam. Asperiores totam sint inventore illum eos harum ex non ut.,https://s3-us-west-1.amazonaws.com/hrfrontendcapstone/regular_3.png,https://s3-us-west-1.amazonaws.com/hrfrontendcapstone/1.jpeg
64,81,35,2018-05-08,Dolorem quaerat veritatis architecto suscipit voluptatem nisi totam esse minima. Cum labore et sapiente et exercitationem debitis. Et molestiae corrupti voluptatem. Ea a consequatur deserunt quisquam blanditiis suscipit et. Numquam facilis ab facere eveniet praesentium nihil sunt.,https://s3-us-west-1.amazonaws.com/hrfrontendcapstone/regular_1.png,https://s3-us-west-1.amazonaws.com/hrfrontendcapstone/3.jpeg
65,15,55,2018-02-08,Ea sed deleniti molestias exercitationem sit. Vel modi ipsam odit occaecati reprehenderit nobis sed vel et. Ut dolor quibusdam recusandae velit ducimus omnis. Cum omnis incidunt tempore id numquam et quia nihil non. Voluptatem dolor libero eveniet. Distinctio fugit enim exercitationem.,https://s3-us-west-1.amazonaws.com/hrfrontendcapstone/regular_8.png,https://s3-us-west-1.amazonaws.com/hrfrontendcapstone/3.jpeg
66,81,24,2018-06-04,Et id ducimus. Perferendis inventore in. Quidem doloribus soluta temporibus eos. Et quae dolore excepturi atque enim officiis. Facere numquam architecto autem sequi in nihil et. Corrupti culpa tenetur.,https://s3-us-west-1.amazonaws.com/hrfrontendcapstone/regular_8.png,https://s3-us-west-1.amazonaws.com/hrfrontendcapstone/5.jpeg
67,41,87,2018-04-06,Voluptatum fugiat sequi dolor voluptatibus sequi deserunt fuga magnam minus. Beatae beatae repudiandae maiores recusandae qui aut voluptate nam. Est excepturi aut delectus.,https://s3-us-west-1.amazonaws.com/hrfrontendcapstone/regular_9.png,https://s3-us-west-1.amazonaws.com/hrfrontendcapstone/9.jpeg
68,37,46,2018-08-21,Nesciunt facere dolorum. Quia libero modi animi at et perspiciatis et nobis officia. Deserunt blanditiis veritatis cum a quos. Laborum fugit aspernatur totam. Recusandae maiores eaque maxime optio corporis et sunt et sit.,https://s3-us-west-1.amazonaws.com/hrfrontendcapstone/regular_4.png,https://s3-us-west-1.amazonaws.com/hrfrontendcapstone/7.jpeg
69,28,96,2018-01-02,Quam porro quidem nostrum quis eligendi eum possimus eligendi. Dolorum voluptatum velit voluptatem tempora in expedita consequatur beatae. Ipsum enim repellat soluta error consequatur. Qui tempore esse facere molestiae id fuga quasi nihil. Modi facilis iure esse eligendi ab reprehenderit voluptatem. Animi eos quis.,https://s3-us-west-1.amazonaws.com/hrfrontendcapstone/regular_6.png,https://s3-us-west-1.amazonaws.com/hrfrontendcapstone/6.jpeg
70,47,4,2018-05-16,Reiciendis eos officia voluptas qui et. In cupiditate qui et architecto vero facilis. Sed modi natus non sit delectus odio tenetur architecto. Exercitationem fugiat saepe illum et ut nulla.,https://s3-us-west-1.amazonaws.com/hrfrontendcapstone/regular_5.png,https://s3-us-west-1.amazonaws.com/hrfrontendcapstone/2.jpeg
71,48,43,2017-12-19,Ipsa numquam et dolorum omnis harum voluptatibus at. Velit magni quam repellendus dolores. Fugit ullam eos quod natus illum sequi corporis.,https://s3-us-west-1.amazonaws.com/hrfrontendcapstone/regular_6.png,https://s3-us-west-1.amazonaws.com/hrfrontendcapstone/1.jpeg
72,41,100,2018-01-09,Occaecati et est. Aut dicta ut aut recusandae distinctio et repudiandae. Voluptatum quia vitae amet quo possimus. Est omnis quisquam.,https://s3-us-west-1.amazonaws.com/hrfrontendcapstone/regular_7.png,https://s3-us-west-1.amazonaws.com/hrfrontendcapstone/3.jpeg
73,58,28,2018-05-12,Suscipit incidunt quia repellendus ut accusamus consequuntur ullam. Dicta eum dolor laboriosam. Architecto consectetur et autem reprehenderit dolores iure. Nihil nobis rerum eius.,https://s3-us-west-1.amazonaws.com/hrfrontendcapstone/regular_4.png,https://s3-us-west-1.amazonaws.com/hrfrontendcapstone/8.jpeg
74,61,34,2017-12-03,Labore officiis repudiandae eum qui voluptatem excepturi et. Voluptates ipsa consequatur temporibus totam. Aut et est id nam eaque. Culpa et ab est accusantium.,https://s3-us-west-1.amazonaws.com/hrfrontendcapstone/regular_3.png,https://s3-us-west-1.amazonaws.com/hrfrontendcapstone/8.jpeg
75,69,31,2018-06-19,Ex dolores est optio hic. Quisquam perspiciatis incidunt alias. Consectetur quasi enim asperiores ut est inventore doloribus. Maxime consequatur adipisci et vel dolorem atque numquam amet et. Et qui ea.,https://s3-us-west-1.amazonaws.com/hrfrontendcapstone/regular_6.png,https://s3-us-west-1.amazonaws.com/hrfrontendcapstone/7.jpeg
