id,user_id,restaurant_id,date,review_comment,score,picture_food
441,2,7,2018-10-28,Quae nisi est harum corrupti pariatur. Numquam alias mollitia voluptate occaecati rerum error minima dolorum. Accusantium culpa aut impedit et necessitatibus consequuntur. Rerum dolorem et corporis quae optio. Cum voluptatem cum culpa et omnis fugit.,https://s3-us-west-1.amazonaws.com/hrfrontendcapstone/regular_6.png,https://s3-us-west-1.amazonaws.com/hrfrontendcapstone/8.jpeg
442,87,89,2018-08-30,Quas dolor perferendis voluptatum impedit quas sit. Aut aut vel laudantium quis doloremque est. Ut aspernatur voluptatem voluptatibus qui earum harum molestiae. Et provident non et. Vitae exercitationem ipsam et reprehenderit asperiores voluptas quas veniam.,https://s3-us-west-1.amazonaws.com/hrfrontendcapstone/regular_6.png,https://s3-us-west-1.amazonaws.com/hrfrontendcapstone/6.jpeg
443,72,87,2018-10-26,Provident necessitatibus incidunt nulla et pariatur corporis beatae. Dicta ut ea. Doloribus iusto minus perspiciatis quae. Eos mollitia sapiente autem sed nostrum voluptatum maiores enim vel. Praesentium quos exercitationem impedit aliquid. Tempora deserunt consequatur minus eaque accusantium enim voluptates.,https://s3-us-west-1.amazonaws.com/hrfrontendcapstone/regular_8.png,https://s3-us-west-1.amazonaws.com/hrfrontendcapstone/8.jpeg
444,43,44,2018-01-26,Ut temporibus ex autem voluptatum quo distinctio. Aliquid sit recusandae sed sed id voluptatem quidem. Mollitia sunt vitae amet repudiandae magnam nemo. Consequuntur exercitationem necessitatibus ut qui rerum assumenda et quod.,https://s3-us-west-1.amazonaws.com/hrfrontendcapstone/regular_1.png,https://s3-us-west-1.amazonaws.com/hrfrontendcapstone/6.jpeg
445,52,47,2018-03-27,Aut voluptatum nobis asperiores alias eos vero autem. Itaque asperiores ut ut in qui. Voluptate recusandae ipsum suscipit.,https://s3-us-west-1.amazonaws.com/hrfrontendcapstone/regular_4.png,https://s3-us-west-1.amazonaws.com/hrfrontendcapstone/4.jpeg
446,38,81,2018-03-09,Qui eius expedita quia. Praesentium aliquid minus possimus provident in consequatur in culpa. Maiores iste et nesciunt ipsum ut repellendus sunt. Nostrum et provident adipisci et. Eligendi velit eos unde facilis quia ut aspernatur dignissimos.,https://s3-us-west-1.amazonaws.com/hrfrontendcapstone/regular_6.png,https://s3-us-west-1.amazonaws.com/hrfrontendcapstone/5.jpeg
447,81,58,2018-06-12,Recusandae at unde. Rem dolore cumque quo doloremque molestias laborum atque necessitatibus. Dicta eos cum. Necessitatibus est est.,https://s3-us-west-1.amazonaws.com/hrfrontendcapstone/regular_7.png,https://s3-us-west-1.amazonaws.com/hrfrontendcapstone/2.jpeg
448,40,31,2018-02-16,Labore voluptas sed et debitis laboriosam ea eveniet voluptatem. Ut ea et suscipit. Ab reiciendis iure et. Aliquam ullam numquam aut.,https://s3-us-west-1.amazonaws.com/hrfrontendcapstone/regular_9.png,https://s3-us-west-1.amazonaws.com/hrfrontendcapstone/4.jpeg
449,92,95,2018-04-16,Quae consectetur libero voluptas consequatur. Laborum maxime omnis ea. Eius laudantium at sint quia rerum iusto nihil quo. Similique explicabo incidunt voluptas non excepturi velit et.,https://s3-us-west-1.amazonaws.com/hrfrontendcapstone/regular_8.png,https://s3-us-west-1.amazonaws.com/hrfrontendcapstone/6.jpeg
450,7,58,2018-08-15,Repellendus ea ut recusandae occaecati eum consequatur ut qui aut. Aut itaque tempore et sunt qui consequatur. Et cumque autem amet sit qui. In placeat iusto perferendis in id vel eius sint et.,https://s3-us-west-1.amazonaws.com/hrfrontendcapstone/regular_1.png,https://s3-us-west-1.amazonaws.com/hrfrontendcapstone/1.jpeg
451,66,82,2018-10-06,Esse molestiae nemo ut aut in odit. Molestias est error adipisci. Sunt totam ipsa enim ut. Culpa excepturi voluptatem. At voluptates explicabo ipsum ab.,https://s3-us-west-1.amazonaws.com/hrfrontendcapstone/regular_6.png,https://s3-us-west-1.amazonaws.com/hrfrontendcapstone/5.jpeg
452,78,69,2018-03-19,Repudiandae autem eos veniam. Repellendus vel voluptatem. Quia reiciendis repellendus corrupti.,https://s3-us-west-1.amazonaws.com/hrfrontendcapstone/regular_5.png,https://s3-us-west-1.amazonaws.com/hrfrontendcapstone/1.jpeg
453,99,55,2018-03-08,Corrupti aut eum cum et soluta blanditiis. Qui aut illo reiciendis laboriosam nostrum nostrum rerum enim. At et natus. Dolorem ratione quo voluptate iusto. Esse reiciendis cumque voluptas sunt laudantium. Nisi corporis sed vero eum exercitationem quis nobis.,https://s3-us-west-1.amazonaws.com/hrfrontendcapstone/regular_3.png,https://s3-us-west-1.amazonaws.com/hrfrontendcapstone/3.jpeg
454,94,35,2018-10-31,Architecto in aut maxime. Tempora ut repudiandae autem et qui aliquid officia consequuntur. Et et id ratione. Repudiandae facilis ipsam deserunt ut beatae delectus velit totam.,https://s3-us-west-1.amazonaws.com/hrfrontendcapstone/regular_7.png,https://s3-us-west-1.amazonaws.com/hrfrontendcapstone/6.jpeg
455,89,40,2018-04-05,Non autem autem eaque neque blanditiis ut ea aliquid. Quia exercitationem eveniet aliquid. Sint et blanditiis eius consequuntur necessitatibus esse. Fugiat repellat autem adipisci.,https://s3-us-west-1.amazonaws.com/hrfrontendcapstone/regular_8.png,https://s3-us-west-1.amazonaws.com/hrfrontendcapstone/1.jpeg
456,47,46,2018-10-11,Recusandae in ducimus a velit quasi sunt autem magni. Repudiandae vel hic fugit omnis et qui a. Possimus quasi eum totam molestiae aspernatur repellat.,https://s3-us-west-1.amazonaws.com/hrfrontendcapstone/regular_6.png,https://s3-us-west-1.amazonaws.com/hrfrontendcapstone/1.jpeg
457,98,24,2018-04-16,Quisquam consequatur excepturi facilis eum alias consequatur sed saepe quod. Facilis numquam quis ea quia. Aperiam numquam quisquam voluptatem quidem et voluptas fugit quibusdam corporis. Dolores molestiae dolorum nam impedit ex fuga suscipit unde. Non enim rerum voluptate reprehenderit architecto est. Distinctio atque qui quia.,https://s3-us-west-1.amazonaws.com/hrfrontendcapstone/regular_4.png,https://s3-us-west-1.amazonaws.com/hrfrontendcapstone/2.jpeg
458,24,64,2018-03-23,Maxime iusto illo sit voluptates ad. Quia earum ut corporis voluptatem. Consequuntur veritatis exercitationem accusamus voluptas dolorem. Dolores nihil nostrum delectus itaque libero quia aut.,https://s3-us-west-1.amazonaws.com/hrfrontendcapstone/regular_3.png,https://s3-us-west-1.amazonaws.com/hrfrontendcapstone/7.jpeg
459,23,41,2018-09-26,Repellat sunt maiores praesentium iure dolor libero non dolorum. Dolorem dolores ducimus minus quas amet quia. Tempore harum nihil dolore fuga voluptas animi. Qui rerum autem atque et autem.,https://s3-us-west-1.amazonaws.com/hrfrontendcapstone/regular_9.png,https://s3-us-west-1.amazonaws.com/hrfrontendcapstone/9.jpeg
460,74,39,2018-01-08,Magni alias numquam magnam alias quae. Ratione et officiis excepturi. Nihil reiciendis aut error maxime ab qui pariatur rerum. Accusamus animi ea non. Sint aut fugiat consequatur adipisci molestiae ipsam et. Est omnis sequi dignissimos amet quae.,https://s3-us-west-1.amazonaws.com/hrfrontendcapstone/regular_7.png,https://s3-us-west-1.amazonaws.com/hrfrontendcapstone/4.jpeg
461,35,35,2018-06-02,Tenetur id eaque voluptates nihil sed. Aut assumenda enim voluptatibus dolores. Voluptas aut non a aperiam eaque cumque voluptatem repellendus.,https://s3-us-west-1.amazonaws.com/hrfrontendcapstone/regular_2.png,https://s3-us-west-1.amazonaws.com/hrfrontendcapstone/2.jpeg
462,37,68,2018-02-28,Ipsa amet est ipsam similique. In in necessitatibus. Ut aliquid velit quia quia veritatis est aut cum. Quo et cumque molestiae odio quia quod similique earum deleniti.,https://s3-us-west-1.amazonaws.com/hrfrontendcapstone/regular_6.png,https://s3-us-west-1.amazonaws.com/hrfrontendcapstone/6.jpeg
463,25,90,2018-10-12,Fugiat est reiciendis et. Qui cumque aperiam assumenda. Id quas consequuntur quaerat. Adipisci dolorum laudantium.,https://s3-us-west-1.amazonaws.com/hrfrontendcapstone/regular_3.png,https://s3-us-west-1.amazonaws.com/hrfrontendcapstone/6.jpeg
464,13,67,2018-11-09,Voluptas non unde itaque eum nemo. Id molestias molestiae exercitationem repudiandae consequatur ad. Sint natus corrupti sunt nihil iusto natus. Nostrum praesentium et rem.,https://s3-us-west-1.amazonaws.com/hrfrontendcapstone/regular_5.png,https://s3-us-west-1.amazonaws.com/hrfrontendcapstone/9.jpeg
465,2,84,2018-11-05,Omnis tempora ut quo dolorum. Voluptatibus sit possimus nam asperiores beatae est laudantium. Omnis dolores corporis at nemo. Quam officiis soluta aliquid repellendus et qui et dolorem accusantium. Ab ad sit vel eius ipsam adipisci odio.,https://s3-us-west-1.amazonaws.com/hrfrontendcapstone/regular_5.png,https://s3-us-west-1.amazonaws.com/hrfrontendcapstone/4.jpeg
466,74,61,2018-01-03,Qui rem ipsam similique consequatur qui qui. Doloribus dolor quam quasi voluptas qui dolores velit aperiam molestiae. Dolorem recusandae vitae voluptas iste. Qui doloribus dolorem eaque qui perferendis dolor.,https://s3-us-west-1.amazonaws.com/hrfrontendcapstone/regular_7.png,https://s3-us-west-1.amazonaws.com/hrfrontendcapstone/6.jpeg
467,28,32,2018-08-17,Voluptatibus magnam aut quis accusantium et sapiente explicabo quas. Perferendis reiciendis neque eos minima qui aut. Dolorem enim ut. Illo rem atque sint totam est unde laboriosam ratione. Voluptatibus id eaque.,https://s3-us-west-1.amazonaws.com/hrfrontendcapstone/regular_9.png,https://s3-us-west-1.amazonaws.com/hrfrontendcapstone/8.jpeg
468,36,96,2018-08-25,Vel commodi commodi quia. Sequi illum accusamus impedit eum. Neque eos quisquam libero cumque ratione iusto necessitatibus.,https://s3-us-west-1.amazonaws.com/hrfrontendcapstone/regular_8.png,https://s3-us-west-1.amazonaws.com/hrfrontendcapstone/2.jpeg
469,85,53,2018-07-11,Voluptatem dicta sunt eos reprehenderit quo. Ex beatae commodi dolor labore unde quia harum iste fugiat. Non et adipisci et. Tenetur nobis officiis architecto. Sint culpa aut repellendus voluptatem aut voluptas dolorum perspiciatis amet. Et facere enim itaque asperiores cum.,https://s3-us-west-1.amazonaws.com/hrfrontendcapstone/regular_2.png,https://s3-us-west-1.amazonaws.com/hrfrontendcapstone/2.jpeg
470,49,87,2018-01-11,Tenetur voluptatum sunt fugiat suscipit magni aliquid laudantium aliquam aut. Minima voluptas voluptatem provident et facilis placeat quo corrupti. Quis laborum magni consequuntur iste. Sequi corrupti accusantium dolores recusandae et perspiciatis praesentium consequatur non. Aut quae illo est ex.,https://s3-us-west-1.amazonaws.com/hrfrontendcapstone/regular_8.png,https://s3-us-west-1.amazonaws.com/hrfrontendcapstone/7.jpeg
471,98,59,2018-01-25,Neque sequi omnis aut ut laboriosam doloribus mollitia. Repellat sit blanditiis incidunt. Ut ad commodi.,https://s3-us-west-1.amazonaws.com/hrfrontendcapstone/regular_5.png,https://s3-us-west-1.amazonaws.com/hrfrontendcapstone/3.jpeg
472,91,53,2018-05-18,Et omnis et non qui maxime ab. Fugit unde est nemo iste id ut at mollitia. Omnis est voluptates cupiditate ea veritatis aut iure.,https://s3-us-west-1.amazonaws.com/hrfrontendcapstone/regular_2.png,https://s3-us-west-1.amazonaws.com/hrfrontendcapstone/8.jpeg
473,90,2,2018-09-13,Modi qui aspernatur optio tenetur totam eveniet nihil voluptatem. Incidunt vel rerum ut asperiores sint veniam voluptatum voluptatibus. Et quia omnis non itaque ut aut autem et aliquid.,https://s3-us-west-1.amazonaws.com/hrfrontendcapstone/regular_7.png,https://s3-us-west-1.amazonaws.com/hrfrontendcapstone/2.jpeg
474,38,57,2018-08-30,Est delectus doloribus et aut. Qui sed aliquid. Assumenda itaque ex vel deserunt. Voluptas ipsam optio repellat. Accusantium modi non qui.,https://s3-us-west-1.amazonaws.com/hrfrontendcapstone/regular_6.png,https://s3-us-west-1.amazonaws.com/hrfrontendcapstone/3.jpeg
475,64,34,2017-12-24,Et placeat pariatur voluptas vel. Assumenda temporibus fugiat eos consequatur eum ipsum. Consequuntur aut et odio repellat voluptatem dignissimos id ad ut.,https://s3-us-west-1.amazonaws.com/hrfrontendcapstone/regular_1.png,https://s3-us-west-1.amazonaws.com/hrfrontendcapstone/2.jpeg
476,38,74,2018-06-21,Esse ut dolorem itaque. Est impedit facere illo maiores. Libero vel voluptas est ullam eveniet minus in assumenda. Facilis expedita officiis et tempore qui sed.,https://s3-us-west-1.amazonaws.com/hrfrontendcapstone/regular_9.png,https://s3-us-west-1.amazonaws.com/hrfrontendcapstone/4.jpeg
477,84,75,2018-04-20,Sed ipsam doloribus a. Ipsum quod rerum optio tempora. Repellendus et quo sunt voluptatem itaque. Ut voluptas quia soluta non autem cum sit nam. Assumenda sint quaerat.,https://s3-us-west-1.amazonaws.com/hrfrontendcapstone/regular_9.png,https://s3-us-west-1.amazonaws.com/hrfrontendcapstone/9.jpeg
478,76,45,2018-06-12,Et iste sit enim eos omnis facere voluptas tempora. Ab voluptatum non nihil. Quis adipisci officia vel. Quo quo id dolor optio quia ut nemo. Dolorem omnis sed ut rerum et harum esse dolorum id. Deleniti sit aut optio.,https://s3-us-west-1.amazonaws.com/hrfrontendcapstone/regular_7.png,https://s3-us-west-1.amazonaws.com/hrfrontendcapstone/4.jpeg
479,61,57,2018-07-12,Tempore dicta cum et accusantium facere cum. Praesentium quia provident enim. Sapiente tempora accusamus et enim eligendi. Possimus accusamus animi omnis eum quia in facere. Non et eius natus maxime dolor quisquam aut ea quis. Eaque tempora suscipit ratione delectus praesentium culpa provident saepe.,https://s3-us-west-1.amazonaws.com/hrfrontendcapstone/regular_6.png,https://s3-us-west-1.amazonaws.com/hrfrontendcapstone/8.jpeg
480,1,79,2018-11-01,Harum dolores sint. Corrupti similique quo distinctio cupiditate sapiente. Nulla temporibus id tenetur veniam repudiandae sunt aut possimus eius. Quis autem dolor delectus ut corrupti est inventore. Vitae natus fuga eligendi repudiandae dolores eligendi et ipsa nisi.,https://s3-us-west-1.amazonaws.com/hrfrontendcapstone/regular_3.png,https://s3-us-west-1.amazonaws.com/hrfrontendcapstone/9.jpeg
481,76,31,2017-12-06,Iusto ipsam totam ea alias nulla quo quidem. Corporis officiis quo recusandae dolore natus nihil. Ipsum iure quidem doloribus ab reprehenderit reprehenderit autem.,https://s3-us-west-1.amazonaws.com/hrfrontendcapstone/regular_1.png,https://s3-us-west-1.amazonaws.com/hrfrontendcapstone/3.jpeg
482,87,59,2018-07-11,Voluptas est et cumque animi vero rerum itaque. Asperiores fuga nesciunt iusto non ipsum amet id dicta. Tempora alias molestiae qui recusandae quis dolor rerum. Cum eos enim adipisci. Illum quos asperiores magni ex unde magni laboriosam.,https://s3-us-west-1.amazonaws.com/hrfrontendcapstone/regular_7.png,https://s3-us-west-1.amazonaws.com/hrfrontendcapstone/7.jpeg
483,12,35,2018-11-06,Eaque autem qui fugiat porro in perspiciatis ut debitis nostrum. Nisi aliquid debitis rerum ex accusantium quia quos ab. Incidunt consequatur reiciendis soluta consequatur blanditiis amet recusandae.,https://s3-us-west-1.amazonaws.com/hrfrontendcapstone/regular_8.png,https://s3-us-west-1.amazonaws.com/hrfrontendcapstone/3.jpeg
484,95,26,2018-06-12,Qui impedit distinctio eaque placeat aut omnis dolorum. Asperiores aut provident iste dolores. Quis doloribus sequi.,https://s3-us-west-1.amazonaws.com/hrfrontendcapstone/regular_7.png,https://s3-us-west-1.amazonaws.com/hrfrontendcapstone/3.jpeg
485,57,80,2018-11-01,Et repellat blanditiis sed voluptas. Doloribus dolorum excepturi. Nihil eum et sed. Quisquam unde iusto facere saepe dolores.,https://s3-us-west-1.amazonaws.com/hrfrontendcapstone/regular_9.png,https://s3-us-west-1.amazonaws.com/hrfrontendcapstone/6.jpeg
486,13,44,2018-03-03,Mollitia vel optio maxime totam repudiandae ex similique. Maiores nemo cupiditate. Consectetur temporibus ea et quia magni modi fugit. Voluptatum ducimus molestiae harum.,https://s3-us-west-1.amazonaws.com/hrfrontendcapstone/regular_9.png,https://s3-us-west-1.amazonaws.com/hrfrontendcapstone/4.jpeg
487,55,2,2018-06-23,Voluptatibus dolore pariatur eius molestiae consectetur. Qui aspernatur velit cupiditate et architecto perferendis. Enim et velit voluptatem et est perspiciatis qui distinctio sed. Eos fugiat tenetur placeat accusamus molestiae.,https://s3-us-west-1.amazonaws.com/hrfrontendcapstone/regular_4.png,https://s3-us-west-1.amazonaws.com/hrfrontendcapstone/5.jpeg
488,67,46,2017-12-20,Voluptas id iste sapiente. Voluptates molestiae distinctio quo eos repudiandae et. Atque distinctio iste quia aut quasi rem.,https://s3-us-west-1.amazonaws.com/hrfrontendcapstone/regular_3.png,https://s3-us-west-1.amazonaws.com/hrfrontendcapstone/6.jpeg
489,19,59,2018-06-24,Exercitationem et commodi voluptatem in reprehenderit voluptates dolorem at et. Id nesciunt aut unde eos fugiat. Sit animi omnis est eaque ex temporibus exercitationem sed. Totam et optio quae sint.,https://s3-us-west-1.amazonaws.com/hrfrontendcapstone/regular_4.png,https://s3-us-west-1.amazonaws.com/hrfrontendcapstone/9.jpeg
490,65,85,2018-07-07,Et voluptas est est doloremque consequuntur quod est quia. Et sit quam nobis. Ut qui repudiandae laborum beatae fugiat impedit doloribus. Maxime facere aperiam quia. Quae iusto sit quis hic dolorem iure quod.,https://s3-us-west-1.amazonaws.com/hrfrontendcapstone/regular_2.png,https://s3-us-west-1.amazonaws.com/hrfrontendcapstone/5.jpeg
491,56,96,2018-09-14,Saepe et ipsa pariatur sed optio et quisquam velit qui. Ea unde placeat dolor maiores voluptatum in totam eligendi. Qui soluta atque numquam reprehenderit non qui voluptas quod. Non facere asperiores rerum ea. Dignissimos nihil ut.,https://s3-us-west-1.amazonaws.com/hrfrontendcapstone/regular_2.png,https://s3-us-west-1.amazonaws.com/hrfrontendcapstone/6.jpeg
492,22,78,2018-06-26,Quia nisi sit et ipsa et voluptates. Sit voluptas aut ullam nesciunt dolor consequuntur. Consectetur eum neque quos dolore exercitationem enim repudiandae et omnis. Molestias est ipsum. Mollitia et quos possimus.,https://s3-us-west-1.amazonaws.com/hrfrontendcapstone/regular_8.png,https://s3-us-west-1.amazonaws.com/hrfrontendcapstone/3.jpeg
493,9,85,2018-09-11,Dolores accusantium dolores sunt praesentium. Quis voluptate commodi est ab doloremque nesciunt quia velit. Molestias amet nesciunt non delectus. Aspernatur tempora dolore id vero aliquid voluptatem ad odit. Temporibus commodi tempora molestias et sapiente.,https://s3-us-west-1.amazonaws.com/hrfrontendcapstone/regular_7.png,https://s3-us-west-1.amazonaws.com/hrfrontendcapstone/3.jpeg
494,83,97,2018-04-30,Qui alias quo quis at reprehenderit officiis. Sed animi magnam hic reiciendis ut alias. Suscipit sed et delectus. Recusandae inventore eius veritatis sit.,https://s3-us-west-1.amazonaws.com/hrfrontendcapstone/regular_1.png,https://s3-us-west-1.amazonaws.com/hrfrontendcapstone/5.jpeg
495,66,53,2018-08-12,Consequatur alias quos at consequatur quibusdam nisi ipsum culpa ratione. Distinctio voluptas omnis ut deleniti repellat et velit. Et vitae consequatur iste non. Eaque qui ipsum minus consectetur voluptatem voluptas porro officiis ut.,https://s3-us-west-1.amazonaws.com/hrfrontendcapstone/regular_9.png,https://s3-us-west-1.amazonaws.com/hrfrontendcapstone/7.jpeg
496,56,13,2018-01-21,Qui aut eveniet incidunt. Tenetur unde illum voluptatem. Aliquid saepe laboriosam adipisci ipsum magni eum quae est ullam. Ratione possimus a ut odit.,https://s3-us-west-1.amazonaws.com/hrfrontendcapstone/regular_2.png,https://s3-us-west-1.amazonaws.com/hrfrontendcapstone/6.jpeg
497,35,26,2018-04-26,Quos ut in. Eveniet est omnis minus velit quia itaque odio vel. Odit quis voluptas et aut doloremque et quo. Quo dignissimos ratione sint consequatur consequuntur hic. Qui repudiandae aut aut sapiente laudantium facere doloribus.,https://s3-us-west-1.amazonaws.com/hrfrontendcapstone/regular_8.png,https://s3-us-west-1.amazonaws.com/hrfrontendcapstone/1.jpeg
498,4,18,2018-06-12,Est dolor aperiam asperiores quo ut perspiciatis voluptatem. Et laborum distinctio ut perspiciatis fugiat ducimus neque. Quis temporibus rerum et inventore praesentium. Ea quia debitis et.,https://s3-us-west-1.amazonaws.com/hrfrontendcapstone/regular_8.png,https://s3-us-west-1.amazonaws.com/hrfrontendcapstone/4.jpeg
499,99,30,2018-09-03,Nam accusantium sed aut id. Debitis quibusdam veritatis nulla saepe. Et est expedita perspiciatis rerum a rerum rerum aliquam accusamus.,https://s3-us-west-1.amazonaws.com/hrfrontendcapstone/regular_5.png,https://s3-us-west-1.amazonaws.com/hrfrontendcapstone/3.jpeg
500,10,69,2018-03-17,Consequuntur non corrupti qui beatae ut cupiditate amet dolorum. Ipsum error blanditiis. Dolor vel fugit.,https://s3-us-west-1.amazonaws.com/hrfrontendcapstone/regular_9.png,https://s3-us-west-1.amazonaws.com/hrfrontendcapstone/7.jpeg
501,52,33,2018-08-08,Recusandae non quia. Ex repellat ut voluptas atque quia. Accusamus nihil atque molestiae magni. Neque vitae vel distinctio quo provident excepturi aliquid dolorem nobis.,https://s3-us-west-1.amazonaws.com/hrfrontendcapstone/regular_4.png,https://s3-us-west-1.amazonaws.com/hrfrontendcapstone/1.jpeg
502,75,31,2018-09-08,Minima ipsum expedita pariatur. Ipsa temporibus fuga provident est. Voluptates quis sed ad. Molestiae enim tenetur dolorem perspiciatis qui quis dolore sunt. Vero quibusdam eaque est numquam. Nulla ipsa voluptates voluptatibus ducimus libero ad eum in.,https://s3-us-west-1.amazonaws.com/hrfrontendcapstone/regular_4.png,https://s3-us-west-1.amazonaws.com/hrfrontendcapstone/7.jpeg
503,84,74,2017-12-05,Sed voluptas id consequatur ea dolores. Nam sit nihil quo adipisci similique dolor. Voluptatibus hic alias quam ab quas maiores. Quibusdam ullam in accusantium non et. Veritatis ut assumenda aut est voluptas ut vel facilis amet. Perferendis eaque ex sed dignissimos est.,https://s3-us-west-1.amazonaws.com/hrfrontendcapstone/regular_7.png,https://s3-us-west-1.amazonaws.com/hrfrontendcapstone/2.jpeg
504,91,8,2018-05-02,Sunt dolorem suscipit reiciendis et. Amet ut tenetur numquam illum ratione. Natus aspernatur cumque facere.,https://s3-us-west-1.amazonaws.com/hrfrontendcapstone/regular_2.png,https://s3-us-west-1.amazonaws.com/hrfrontendcapstone/3.jpeg
505,48,19,2018-10-19,Aut officiis ea enim fuga iure omnis officiis. In et vero. Alias sunt consequatur et. Molestiae occaecati assumenda unde eius a sint.,https://s3-us-west-1.amazonaws.com/hrfrontendcapstone/regular_5.png,https://s3-us-west-1.amazonaws.com/hrfrontendcapstone/7.jpeg
506,89,60,2018-09-29,Quasi quibusdam qui illum facilis magni debitis eligendi aperiam. Est et nesciunt ipsam excepturi fugiat ducimus quia cum. Voluptatem non quisquam sed quibusdam. Magni provident sit vel sint nam placeat iure.,https://s3-us-west-1.amazonaws.com/hrfrontendcapstone/regular_1.png,https://s3-us-west-1.amazonaws.com/hrfrontendcapstone/7.jpeg
507,95,9,2018-04-07,Aut quo et vitae provident neque minus quia aliquam non. Omnis voluptatem animi. Et iste numquam et quia. Qui molestiae corporis nulla dolores expedita ipsum. Aliquam ut quam est.,https://s3-us-west-1.amazonaws.com/hrfrontendcapstone/regular_4.png,https://s3-us-west-1.amazonaws.com/hrfrontendcapstone/5.jpeg
508,35,33,2017-12-02,Excepturi nihil corporis praesentium soluta optio voluptas numquam commodi est. Voluptates et magni blanditiis iusto sapiente voluptate. Tenetur expedita qui architecto consequatur eum. Consectetur totam perferendis eveniet quos ea accusamus temporibus.,https://s3-us-west-1.amazonaws.com/hrfrontendcapstone/regular_4.png,https://s3-us-west-1.amazonaws.com/hrfrontendcapstone/1.jpeg
509,63,68,2018-09-19,Modi ut velit nisi corporis deleniti perspiciatis. Laborum ipsum labore. Unde ea ducimus necessitatibus officiis consequuntur at. Culpa magni hic commodi est commodi debitis eaque rem accusamus. Occaecati iusto deleniti laudantium quaerat. Aut ullam enim ut neque autem aut iure aperiam quia.,https://s3-us-west-1.amazonaws.com/hrfrontendcapstone/regular_2.png,https://s3-us-west-1.amazonaws.com/hrfrontendcapstone/5.jpeg
510,40,43,2018-10-26,Animi natus sed. Tempora ex adipisci. Est tempora in nihil. Non et voluptas nostrum omnis debitis mollitia. Assumenda sed nobis. Non ut voluptas quia similique consequatur sed numquam rerum.,https://s3-us-west-1.amazonaws.com/hrfrontendcapstone/regular_4.png,https://s3-us-west-1.amazonaws.com/hrfrontendcapstone/7.jpeg
511,13,31,2018-09-27,Eius est blanditiis. Sint aspernatur provident est aut suscipit id qui saepe. Quaerat qui dignissimos est quisquam error voluptatem. Nihil autem veniam quis maxime.,https://s3-us-west-1.amazonaws.com/hrfrontendcapstone/regular_6.png,https://s3-us-west-1.amazonaws.com/hrfrontendcapstone/1.jpeg
512,14,31,2018-01-15,Aliquam laudantium tempore non sint voluptatem consequuntur. Itaque ut odit odit et voluptatibus sunt fugit. Magni natus omnis libero consequatur quis delectus aut in iure. Itaque autem maiores suscipit facere quia voluptatibus est incidunt.,https://s3-us-west-1.amazonaws.com/hrfrontendcapstone/regular_5.png,https://s3-us-west-1.amazonaws.com/hrfrontendcapstone/2.jpeg
513,74,37,2018-03-09,Incidunt tempore mollitia. Numquam tenetur quas. Asperiores maiores ea in error quibusdam qui nihil recusandae voluptatibus.,https://s3-us-west-1.amazonaws.com/hrfrontendcapstone/regular_6.png,https://s3-us-west-1.amazonaws.com/hrfrontendcapstone/4.jpeg
514,46,4,2017-12-22,Amet molestiae aut ullam nam tenetur ipsam. Consequuntur aut qui voluptas est quibusdam ipsum nostrum vitae recusandae. Aut illum ea. Aliquam architecto atque architecto sit facere quae et tempore.,https://s3-us-west-1.amazonaws.com/hrfrontendcapstone/regular_5.png,https://s3-us-west-1.amazonaws.com/hrfrontendcapstone/9.jpeg
515,62,33,2018-02-06,Repellendus similique corporis dolor ut. Et assumenda in dolorem eum. Perferendis accusamus incidunt aut est ullam omnis est qui.,https://s3-us-west-1.amazonaws.com/hrfrontendcapstone/regular_8.png,https://s3-us-west-1.amazonaws.com/hrfrontendcapstone/9.jpeg
516,53,98,2018-03-21,Voluptate quas labore consequatur consequatur. Aut et quo officiis. Quas quasi quisquam qui eligendi.,https://s3-us-west-1.amazonaws.com/hrfrontendcapstone/regular_9.png,https://s3-us-west-1.amazonaws.com/hrfrontendcapstone/7.jpeg
